Control ID,SCF ID,Description,Control Coverage,Response,,,,,,,,,,,,,,,,,,,,,
164.312(b),"MON-01, MON-01.4, MON-01.8, MON-01.16, MON-03, MON-03.2, MON-16","Standard: Audit controls. Implement hardware, software, and/or procedural mechanisms that record and examine activity in information systems that contain or use electronic protected health information.",Contributes,"VMware Cloud Foundation (VCF) implements robust technical mechanisms for recording and examining activity across the infrastructure stack. VCF Operations provides enterprise-wide monitoring, centralized log collection and analysis through VCF Operations for Logs, and an integrated alert generation and response framework. It continuously monitors operational state, collects metrics, ingests logs from all VCF components, and offers dashboards, analytics, and anomaly detection capabilities. Detailed audit events capture user logins, configuration changes, and system interactions, including event type, timestamps, source, outcome, and user identity. VMware Live Recovery (VLR) extends these capabilities to disaster recovery operations, providing event logging, configurable alarms for replication events, and audit trails for DR-specific actions. VMware vDefend contributes network-level security monitoring, generating security event logs from Distributed Firewall, IDS/IPS, and Malware Prevention services, and offering real-time analysis of network traffic flows, suspicious traffic detection, and SIEM integration. These platforms collectively provide comprehensive technical instrumentation for recording and examining activity within information systems.

While the platform provides extensive technical capabilities for recording and examining activity, the customer is responsible for defining and implementing the organizational processes and procedures for ongoing log review, incident escalation, and response. This includes establishing specific alert thresholds, defining incident management workflows, and determining how to prioritize monitoring based on asset criticality and data sensitivity. Furthermore, vDefend, while providing network-level behavioral analytics, does not encompass comprehensive user behavior analytics (UEBA) or user activity monitoring (UAM) across identity, endpoint, or application layers, nor does it correlate user activity across systems to detect account compromise. Organizations must implement dedicated UEBA/UAM tooling to fully address the examination of user behavior.",,,,,,,,,,,,,,,,,,,,,
164.312(c)(1),"GOV-02, DCH-01, DCH-01.2","Standard: Integrity. Implement policies and procedures to protect electronic protected health information from improper alteration or destruction.
",Contributes,"The platform provides comprehensive data integrity protection for electronic protected health information through layered encryption, robust data protection mechanisms, and granular access controls. Data at rest is secured via vSAN encryption and VM Encryption, both leveraging FIPS 140-3 validated cryptographic modules and integrating with external key management systems. Data in transit is protected by TLS across VCF components, vSAN data-in-transit encryption, and Encrypted vMotion, ensuring sensitive information remains encrypted during live migrations and inter-host communication.

For resilience against destruction and rapid recovery from alteration, vSAN data protection offers virtual machine replication, and VMware Live Site Recovery extends this with orchestrated disaster recovery, configurable recovery point objectives, and retention rules across sites. VMware Kubernetes Service includes Velero-based data protection for backup and restore operations, providing visibility into backup and restore operations. Access to collected operational data is controlled through privilege-based access controls, restricting visibility based on user roles.

VMware vDefend enhances data integrity by enforcing microsegmentation with the Distributed Firewall, restricting unauthorized network access to sensitive data stores, databases, and application tiers, thereby limiting the blast radius of a compromise and preventing lateral movement. Security Intelligence identifies risky unencrypted application protocols and highlights unusual communication patterns that may indicate data exfiltration or unauthorized alteration attempts. vDefend IDS/IPS inspects east-west network traffic for signatures and behaviors associated with data theft and exploitation, while Malware Prevention analyzes files traversing the network to detect malicious payloads targeting data integrity. These network security controls complement the platform's data-at-rest encryption, backup, replication, and access management capabilities by protecting the network paths and access patterns through which data is stored, replicated, and retrieved.

The organization is responsible for defining and implementing the specific policies and procedures that govern data integrity, including data classification, encryption key management policies, backup and recovery strategies, access control matrices, and network segmentation rules. This includes establishing acceptable data loss thresholds, defining retention rules, and ensuring that all components are configured in accordance with organizational security policies to protect ePHI from improper alteration or destruction.",,,,,,,,,,,,,,,,,,,,,
164.312(c)(2),"CFG-08, CFG-08.1, MON-01.7, MON-01.15, MON-16","Implementation specification: Mechanism to authenticate electronic protected health information (Addressable). Implement electronic mechanisms to corroborate that electronic protected health information has not been altered or destroyed in an unauthorized manner.

",Contributes,"VMware Cloud Foundation provides a robust security posture through layered access controls, encryption, and platform integrity mechanisms. VCF SSO centralizes authentication with support for multi-factor authentication and identity federation. Role-based access control (RBAC) spans all VCF components, enabling granular permissions and restricting platform-level operations.

Sensitive data can be stored in encrypted form, and vCenter provides fine-grained cryptographic operation privileges.

VCF Operations continuously monitors vCenter and vSphere cluster settings for configuration drifts, notifying administrators of deviations from desired states. vSphere Lifecycle Manager performs compliance checks and remediation for ESX hosts, while Secure Boot and Trusted Platform Module (TPM) attestation detect unauthorized modifications to firmware and boot components.

VCF also provides enhanced activity monitoring for privileged users through audit logging, privilege tracking, and anomaly detection, forwarding these logs to external SIEM platforms for correlation and forensic investigation.

VMware Live Recovery extends these capabilities by providing role-based access control for disaster recovery operations and protecting sensitive data during replication through network encryption.

VMware vDefend contributes to restricting access at the network layer through microsegmentation and firewall policy, identifying at-risk workloads, and generating audit logs for network-level access events and suspicious traffic patterns.

While VMware Cloud Foundation offers comprehensive preventative controls and platform-level integrity verification, it does not include a native File Integrity Monitor (FIM) to watch for unauthorized changes to individual files on disk within guest operating systems or VCF management appliances. Organizations are responsible for deploying a dedicated FIM product alongside VCF to corroborate that electronic protected health information has not been altered or destroyed at the guest or application file level.",,,,,,,,,,,,,,,,,,,,,
164.312(d),"HRS-01, HRS-04, IAC-28, IAC-28.2, IAC-28.3, TPM-01",Standard: Person or entity authentication. Implement procedures to verify that a person or entity seeking access to electronic protected health information is the one claimed.,Contributes,"VMware Cloud Foundation (VCF) implements robust technical procedures to verify the identity of persons or entities seeking access to electronic protected health information. All user authentication flows through VCF SSO, which validates identities against configured identity sources, ensuring proper certificate validation and trusted source verification before issuing session tokens or granting access.

VCF supports federation with external identity providers using SAML through the VCF Identity Broker and OIDC via the vSphere Supervisor platform. This delegation allows VCF to consume identities verified by the organization's external identity management system, which can enforce multifactor authentication and credential validation as prerequisites for VCF access.

Trust between VCF and these identity providers is rigorously established through certificate validation, requiring administrators to verify thumbprints or provide metadata for non-public CAs. The vSphere Supervisor platform further inspects upstream ID token claims, validating username claims to maintain a secure chain of trust from the identity provider's verification process to the VCF session. Account creation within VCF is restricted to System Administrators, and role mappings from federated identity providers require exact matches to prevent unauthorized privilege escalation.

All authentication events are meticulously captured in VCF Operations audit reports, providing comprehensive traceability of identity validation actions for audit review.

While VCF provides the secure framework for authentication and identity consumption, the formal identity proofing process, where an individual presents evidence of their identity to a registration authority, remains an organizational responsibility.

This foundational identity verification, including the issuance of initial credentials and the definition of specific identity verification policies, is managed by the customer's HR and identity management teams through their external identity provider.

VCF's role is to enforce that only users authenticated by these trusted and verified providers can access the platform.",,,,,,,,,,,,,,,,,,,,,
164.312(e)(1),"CFG-02, CRY-03, NET-01",Standard: Transmission security. Implement technical security measures to guard against unauthorized access to electronic protected health information that is being transmitted over an electronic communications network.,Meets,"VMware Cloud Foundation provides robust cryptographic protection for data in transit across management, compute, and storage networks, leveraging FIPS 140-3 validated modules and standardized protocols. VCF management communications utilize TLS by default, with TLS 1.3 as the standard and TLS 1.2 for compatibility, supported by centralized certificate lifecycle management and FIPS mode enforcement through VCF Operations for Networks.

vSAN data-in-transit encryption secures data moving between hosts, while encrypted vSphere vMotion protects VM data during live migrations, employing one-time keys for each session. VM Encryption provides comprehensive confidentiality for data both at rest and in transit to storage backends, as encryption occurs before data reaches the storage layer.

VMware Live Site Recovery further extends this protection to disaster recovery operations, mandating TLS 1.2 encryption for all replication traffic between source ESX hosts and target sites, with mutual certificate-based authentication. VLR also ensures all communications with vCenter instances occur over configurable TLS connections and supports the replication of encrypted virtual machines.

VMware vDefend complements these capabilities by providing TLS inspection for policy enforcement on encrypted traffic flows and identifying risky cleartext application protocols such as HTTP, Telnet, FTP, TFTP, and LDAP. This allows for the detection of unprotected traffic and at-risk workloads, enabling security teams to address gaps in encryption coverage.

The platform's comprehensive suite of features directly implements the technical security measures required to guard against unauthorized access to electronic protected health information during transmission over electronic communication networks.",,,,,,,,,,,,,,,,,,,,,
164.312(e)(2)(i),"CFG-02, CRY-04, NET-01","Implementation specifications: 
Integrity controls (Addressable). Implement security measures to ensure that electronically transmitted electronic protected health information is not improperly modified without detection until disposed of.",Meets,"VMware Cloud Foundation (VCF) and VMware Live Recovery (VLR) implement robust security measures to ensure the integrity of electronically transmitted data.

VCF protects data in transit across management, compute, and storage communication paths through cryptographic mechanisms. All VCF management communications utilize TLS, providing integrity verification via message authentication codes (MACs), with TLS 1.3 as the default protocol and TLS 1.2 for compatibility, both inherently including integrity protection. Cryptographic operations leverage FIPS 140-3 validated modules, and VCF Operations for Networks can enforce FIPS mode. vSAN data-in-transit (DIT) encryption provides integrity protection for storage traffic between hosts, preventing packet manipulation and replay attacks. VCF Operations monitors transmission integrity by tracking frames with bad checksums, which are dropped to prevent corrupted data propagation. Encrypted vSphere vMotion protects the integrity and authenticity of data during VM migrations using one-time keys to prevent replay attacks. NFS 4.1 supports Kerberos-based integrity verification (krb5i) and encryption (krb5p).

VLR and vSphere Replication (VSR) apply cryptographic mechanisms to both management communications and replication data flows. VLR management communications use TLS with MACs and require SSL/TLS certificates. Replication traffic utilizes TLS 1.2 with mutual certificate-based authentication, and network encryption of replication data is mandatory for all new and existing replications from vSphere Replication 9.0.3, ensuring integrity protection by default. The encryption agent on the source ESX host encrypts data before transmission. NSX supports the Wrapped Encapsulating Security Payload (WESP) protocol for network traffic integrity and authentication.

While VCF and VLR provide comprehensive cryptographic integrity controls, VMware vDefend contributes to transmission integrity monitoring through IDS/IPS signature rules that detect protocol anomalies and tampering indicators, and Security Intelligence and NDR sensors track TCP reassembly gaps. However, vDefend does not provide cryptographic integrity mechanisms for data in transit; these protections are inherent to the underlying transport protocols and applications. Customers are responsible for configuring and enabling optional integrity features, such as vSAN DIT encryption or specific encrypted vMotion settings, and ensuring that applications transmitting electronic protected health information (ePHI) leverage the platform's secure transport mechanisms and cryptographic capabilities.",,,,,,,,,,,,,,,,,,,,,
164.312(e)(2)(ii),"CFG-02, CRY-01, OPS-03","Implementation specifications: 
Encryption (Addressable). Implement a mechanism to encrypt electronic protected health information whenever deemed appropriate.",Contributes,"VMware Cloud Foundation implements extensive cryptographic protections using FIPS 140-3 validated modules, TLS 1.3/1.2 for internal communications, and default encryption for system management networks. It provides comprehensive data-at-rest encryption via vSAN cluster-based encryption or VM Encryption, supporting external KMIP 1.1-compatible Key Management Servers or vSphere Native Key Provider. Key management includes a three-element domain of trust, KEK/DEK wrapping, a three-tier key hierarchy with automatic key rotation, and fine-grained vCenter privileges to control cryptographic operations.

Guest-level encryption is supported through vTPM 2.0 and Secure Boot. Data-in-transit encryption is provided for vSAN (DIT encryption), vSphere vMotion, Memory Tiering, and various storage protocols like iSCSI, Fibre Channel Gen 7, and NFS 4.1 (krb5p). ESX stores configuration data encrypted, leveraging TPM 2.0.

VMware Live Recovery mandates TLS 1.2 encryption for all replication traffic between protected and recovery sites in vSphere Replication 9.0.3 and later, and supports the replication of encrypted virtual machines, requiring shared KMS or vSphere Native Key Provider for key management across sites.

VMware vDefend secures inter-component communications using TLS 1.2 with approved cipher suites and robust certificate management, encrypts its stored data using AES 256-bit, and provides TLS Inspection capabilities via the Gateway Firewall to decrypt, inspect, and re-encrypt network traffic for enhanced security enforcement.

The platform provides the necessary technical mechanisms for encryption. The customer is responsible for defining and implementing organizational policies and procedures to determine when encryption is deemed appropriate for electronic protected health information (ePHI). This includes identifying ePHI, configuring and enabling the available encryption features (such as VM Encryption, vSAN encryption, TLS inspection, and specific network encryption settings) based on their risk assessment, and managing the associated cryptographic keys and certificates in accordance with their security policies.",,,,,,,,,,,,,,,,,,,,,
164.314(a)(1),CPL-01,"Standard: Business associate contracts or other arrangements. The contract or other arrangement required by § 164.308(b)(3) must meet the requirements of paragraph (a)(2)(i), (a)(2)(ii), or (a)(2)(iii) of this section, as applicable.",Not Applicable,"VCF delivers a robust, secure infrastructure foundation, encompassing capabilities for access control, data encryption, network segmentation, and comprehensive logging and auditing. These technical controls are fundamental to establishing a secure environment for sensitive workloads. The platform's operational scope is confined to the technical aspects of infrastructure management and data protection within its boundaries.

The requirement for business associate contracts or other formal arrangements is a legal and administrative mandate. VCF does not possess the functionality to generate, manage, or enforce these contractual agreements, nor does it participate in the legal review or negotiation processes associated with such arrangements. The establishment, maintenance, and oversight of all business associate agreements remain solely within the purview of the customer's legal and compliance functions.",,,,,,,,,,,,,,,,,,,,,
164.314(a)(2)(i)(B),TPM-05.2,"Implementation specifications (Required) 
Report to the covered entity any security incident of which it becomes aware, including breaches of unsecured protected health information as required by § 164.410.",Not Applicable,"VCF provides a secure, hardened infrastructure foundation with extensive logging and monitoring capabilities across its compute, storage, and network layers. These foundational elements are critical for detecting potential security incidents and collecting relevant data for analysis.

The platform does not, however, automate or directly perform the reporting of security incidents or breaches to a covered entity. The establishment of incident response procedures, the definition of reporting workflows, and the execution of timely communication regarding security incidents and breaches remain the sole responsibility of the customer. This encompasses the implementation of organizational policies, processes, and human accountability for incident awareness, assessment, and formal reporting as mandated by regulatory requirements.",,,,,,,,,,,,,,,,,,,,,
164.314(a)(2)(i)(C),TPM-05.1,"Report to the covered entity any security incident of which it becomes aware, including breaches of unsecured protected health information as required by § 164.410.",Not Applicable,"VCF delivers a secure, enterprise-grade cloud infrastructure that generates comprehensive logs and audit trails across its compute, storage, and networking components. These logs are critical inputs for a customer's security operations center to detect and analyze security incidents occurring within the VCF environment.

The establishment and execution of formal processes for reporting security incidents, including breaches of unsecured protected health information, to the covered entity are entirely the customer's responsibility. This encompasses defining incident response policies, establishing communication protocols, assigning personnel accountability, and implementing procedures for timely and accurate reporting as mandated by regulatory requirements.

VCF does not provide capabilities for incident reporting to external entities.",,,,,,,,,,,,,,,,,,,,,
164.314(a)(2)(ii),CPL-01,"Other arrangements. The covered entity is in compliance with paragraph (a)(1) of this section if it has another arrangement in place that meets the requirements of § 164.504(e)(3).

",Not Applicable,"VCF delivers a highly secure and compliant infrastructure foundation, providing robust controls for data isolation, encryption, access management, and audit logging. The platform is designed to support customer workloads requiring stringent regulatory adherence by offering a hardened environment that meets various industry standards.

This control specifically addresses the requirement for a covered entity to establish and maintain formal contractual arrangements, such as Business Associate Agreements, that meet the detailed stipulations of § 164.504(e)(3). These are legal and policy-driven agreements between the covered entity and its partners or other entities.

VCF's technical capabilities are focused on securing the underlying infrastructure and data processing environment, not on the creation, management, or enforcement of a customer's external legal contracts or business arrangements. The platform does not provide functionality to define, store, or validate the content of these external agreements.",,,,,,,,,,,,,,,,,,,,,
164.314(a)(2)(iii),"TPM-05, TPM-05.2",Business associate contracts with subcontractors. The requirements of paragraphs (a)(2)(i) and (a)(2)(ii) of this section apply to the contract or other arrangement between a business associate and a subcontractor required by § 164.308(b)(4) in the same manner as such requirements apply to contracts or other arrangements between a covered entity and business associate.,Not Applicable,"The control mandates the application of specific contractual requirements to agreements between business associates and their subcontractors, ensuring the flow-down of obligations consistent with those between covered entities and business associates.

VMware Cloud Foundation (VCF) provides a robust, secure, and compliant infrastructure for compute, storage, and networking. The platform's technical capabilities are focused on the underlying infrastructure, including virtualization, software-defined networking, and storage management.

VCF does not possess functionality to manage, enforce, or audit legal contracts, business associate agreements, or the specific terms and conditions governing third-party relationships and their subcontractors. The establishment, review, and enforcement of these contractual obligations remain entirely outside the scope of the platform's technical domain.",,,,,,,,,,,,,,,,,,,,,
164.314(b)(1),TPM-05,"Standard: Requirements for group health plans. Except when the only electronic protected health information disclosed to a plan sponsor is disclosed pursuant to § 164.504(f)(1)(ii) or (iii), or as authorized under § 164.508, a group health plan must ensure that its plan documents provide that the plan sponsor will reasonably and appropriately safeguard electronic protected health information created, received, maintained, or transmitted to or by the plan sponsor on behalf of the group health plan.",Not Applicable,"The VCF platform provides comprehensive technical safeguards for electronic protected health information (ePHI) processed and stored within its managed environment. This includes robust encryption at rest and in transit, stringent access controls, continuous monitoring, and audit logging capabilities designed to protect the confidentiality, integrity, and availability of sensitive data.

This control specifically mandates that a group health plan ensure its plan documents contain provisions requiring the plan sponsor to safeguard ePHI.

The VCF platform does not manage or enforce contractual agreements, plan documents, or the policy requirements between a group health plan and its plan sponsor. The responsibility for establishing and verifying these contractual safeguarding obligations rests entirely with the customer, as it pertains to policy and legal documentation rather than direct technical implementation by the platform.",,,,,,,,,,,,,,,,,,,,,
