Control ID,SCF ID,Description,Aggregate Coverage,VCF Coverage,VCF Response,VMware vDefend Coverage,VMware vDefend Response,VCF Protection and Recovery Coverage,VCF Protection and Recovery Response,VMware Data Services Manager Coverage,VMware Data Services Manager Response,VMware Avi Load Balancer Coverage,VMware Avi Load Balancer Response
GOVERN 1.0,"AAT-01, GOV-02, OPS-01.1","Policies, processes, procedures, and practices across the organization related to the mapping, measuring, and managing of AI risks are in place, transparent, and implemented effectively.",Not Applicable,Not Applicable,"End user activity or process, design decision, or activity out of scope.",Not Applicable,"End user activity or process, design decision, or activity out of scope.",Not Applicable,"End user activity or process, design decision, or activity out of scope.",Not Applicable,"End user activity or process, design decision, or activity out of scope.",Not Applicable,"End user activity or process, design decision, or activity out of scope."
GOVERN 1.1,"AAT-01.1, AST-01.2, CPL-01, CPL-01.2","Legal and regulatory requirements involving AI are understood, managed, and documented.",Not Applicable,Not Applicable,"End user activity or process, design decision, or activity out of scope.",Not Applicable,"End user activity or process, design decision, or activity out of scope.",Not Applicable,"End user activity or process, design decision, or activity out of scope.",Not Applicable,"End user activity or process, design decision, or activity out of scope.",Not Applicable,"End user activity or process, design decision, or activity out of scope."
GOVERN 1.2,"AAT-01.2, GOV-02, OPS-01, OPS-01.1, SEA-01, SEA-01.1, TDA-01, TDA-01.1","The characteristics of trustworthy AI are integrated into organizational policies, processes, procedures, and practices.",Contributes,Contributes,"VMware Private AI Services (PAIS) contributes to several of the design characteristics this control addresses, including reliability, security, resilience, and data privacy, through infrastructure-level mechanisms that apply to AI workloads deployed on VMware Cloud Foundation (VCF).

Security. PAIS uses VCF SSO for identity and supports role separation across VI administrator, organization administrator, project administrator, DevOps engineer, data scientist, and MLOps engineer functions, with each role scoped to specific namespaces and operations. The Model Gallery is implemented as a Harbor project, and access to model artifacts is restricted to authorized users. Trust bundles establish authenticated HTTPS connections between PAIS components, the identity provider, the registry, and content management systems. GPU resource entitlements are scoped to the GPU-accelerated workload domain so capacity is not shared across domain boundaries.

Reliability and resilience. PAIS workloads run on VCF, which provides vSphere High Availability for automatic VM restart on host failure, the Distributed Resource Scheduler for workload balancing, and vMotion for live migration of GPU-accelerated VMs when the supporting setting is configured. Cluster sizing guidance recommends maintaining unreserved GPU capacity and a dedicated failover host to accommodate planned upgrades and unplanned host failures. The Model Gallery stores ML models as OCI artifacts with immutable manifests and unique content digests, which supports rollback to a known-good model revision if a newly deployed model behaves incorrectly.

Data privacy. PAIS isolates AI workloads in dedicated workload domains that can be deployed separately from the broader VCF environment. Namespace-scoped permissions restrict which users can access specific workloads and data. The Harbor registry replica architecture keeps the GPU-enabled workload domain isolated by proxying container images through a separate Internet-connected registry in a DMZ, with only registry push and pull traffic permitted between the two.

Model integrity and validation. The validate-then-publish workflow requires MLOps engineers to validate ML models against the organization's security, privacy, and technical requirements before uploading them to the Model Gallery. PAIS scans models for serialization attacks before upload, and model integrity is verified through hash comparison of model files. Each revision pushed to the gallery receives a unique digest. Models can be validated for inference functionality and evaluated for performance and safety against business use cases before production deployment.

PAIS does not address the fairness, transparency, or explainability characteristics this control names, because those properties belong to the AI models themselves rather than the infrastructure platform. Organizations must implement separate controls for bias testing, model interpretability, and output explainability at the application layer.",Contributes,"VMware vDefend contributes to centralized management of cybersecurity controls by providing a unified management plane for network security policy across the virtualized data center. vDefend's centralized capabilities span firewall policy, intrusion detection and prevention, malware prevention, and traffic analytics, all managed through a single interface or, for multi-site deployments, through Global Manager.

The vDefend distributed firewall (DFW) allows administrators to define, organize, and enforce microsegmentation policies from a central management plane. Policies are organized into pre-defined categories (Infrastructure, Environment, Application) that provide a logical structure for managing large rule sets. Administrators can create security groups based on VM attributes, IP sets, or dynamic criteria, and apply east-west firewall rules to those groups consistently. When rules are published, they are pushed from the management plane to every host in the targeted clusters, so enforcement is uniform across the environment without requiring per-host configuration. For multi-site or federated deployments, NSX Federation Security provides centralized management of security policies across all sites through Global Manager. Distributed and Gateway Firewall policies created from Global Manager are synchronized to Local Managers at each registered site. Administrators can define custom regions within a federated deployment and assign specific Security and Network policies to those regions, enabling policy scoping at geographic or administrative boundaries.

In 9.1, vDefend extends centralized policy management to VPC-scoped workloads in VCF Automation. Five system-defined security strategies are available for VPC security posture: VPC Isolation, VPC Isolation with essential services, VPC External Connectivity, VPC Secure Connection, and NONE. Project Administrators can select a pre-defined security posture that enforces Secure by Default principles, rather than manually configuring firewall rules for individual VPCs. The Distributed Firewall supports Organizations in VCF Automation for multi-tenant policy isolation, and the Organization Admin (Tenant Admin) role holds full access to manage Transit Gateway firewalls, distributed firewalls, and all VPC gateway firewalls within that tenant context.

Distributed IDS/IPS and Malware Prevention are centrally managed. IDS/IPS profiles and signature sets are configured centrally and distributed to hosts, and Distributed Malware Prevention rules follow the same publish model as firewall policies. In multi-site environments, IDS/IPS signature management is centralized through Global Manager, which distributes updates to multiple Local Managers and supports both automatic update and manual version control.

Security Services Platform provides centralized network security analytics and visibility through Security Intelligence, which analyzes traffic flows across the data center and generates policy recommendations, including recommended security policies and security groups, that administrators can review and publish as Distributed Firewall rules. The platform includes segmentation planning tools that help administrators design and implement microsegmentation strategies from a central vantage point. Security Services Platform also extends centralized policy management to bare metal servers, where security policies are defined, propagated, and enforced through the same centralized model as virtualized workloads.

Role-based access control within vDefend and Security Services Platform governs who can perform security operations. Security Services Platform defines five roles: Enterprise Admin, Auditor, Security Engineer, Security Operator, and Support Bundle Collector, each with differentiated permissions for policy publishing, traffic visualization, and configuration changes. Configuration of Distributed Firewall policies requires explicit DFW Manage/View rights and rights for Groups and Services, so access to centralized policy management is controlled at the permission level.

vDefend's centralized management is scoped to network security controls. Organization-wide centralized management of all cybersecurity and data protection processes, including identity management, compute hardening, compliance tracking, and governance, requires the broader VCF platform and external GRC systems.",Not Applicable,"End user activity or process, design decision, or activity out of scope.",Not Applicable,"End user activity or process, design decision, or activity out of scope.",Not Applicable,"End user activity or process, design decision, or activity out of scope."
GOVERN 1.3,"CPL-01.2, GOV-02, GOV-04, GOV-04.1, GOV-04.2, OPS-01, OPS-01.1, RSK-01, RSK-01.1, RSK-01.2, RSK-01.3","Processes, procedures, and practices are in place to determine the needed level of risk management activities based on the organization’s risk tolerance.",Not Applicable,Not Applicable,"End user activity or process, design decision, or activity out of scope.",Not Applicable,"End user activity or process, design decision, or activity out of scope.",Not Applicable,"End user activity or process, design decision, or activity out of scope.",Not Applicable,"End user activity or process, design decision, or activity out of scope.",Not Applicable,"End user activity or process, design decision, or activity out of scope."
GOVERN 1.4,"GOV-02, OPS-01, OPS-01.1, RSK-01, RSK-01.1, RSK-01.2","The risk management process and its outcomes are established through transparent policies, procedures, and other controls based on organizational risk priorities.",Not Applicable,Not Applicable,"End user activity or process, design decision, or activity out of scope.",Not Applicable,"End user activity or process, design decision, or activity out of scope.",Not Applicable,"End user activity or process, design decision, or activity out of scope.",Not Applicable,"End user activity or process, design decision, or activity out of scope.",Not Applicable,"End user activity or process, design decision, or activity out of scope."
GOVERN 1.5,"CPL-02, CPL-03, CPL-04, GOV-05, RSK-01, RSK-04, RSK-04.1, RSK-08","Ongoing monitoring and periodic review of the risk management process and its outcomes are planned and organizational roles and responsibilities clearly defined, including determining the frequency of periodic review.",Not Applicable,Not Applicable,"End user activity or process, design decision, or activity out of scope.",Not Applicable,"End user activity or process, design decision, or activity out of scope.",Not Applicable,"End user activity or process, design decision, or activity out of scope.",Not Applicable,"End user activity or process, design decision, or activity out of scope.",Not Applicable,"End user activity or process, design decision, or activity out of scope."
