Control ID,SCF ID,Description,Aggregate Coverage,VCF Coverage,VCF Response,VMware vDefend Coverage,VMware vDefend Response,VCF Protection and Recovery Coverage,VCF Protection and Recovery Response,VMware Data Services Manager Coverage,VMware Data Services Manager Response,VMware Avi Load Balancer Coverage,VMware Avi Load Balancer Response
1.1,"NET-01, NET-02, NET-04, NET-04.1, NET-06, NET-06.1, NET-06.3, NET-06.4, WEB-02",SWIFT Environment Protection,Meets,Meets,"VCF provides built-in mechanisms for implementing and governing network security controls across the infrastructure stack, spanning virtual switching, network segmentation, policy management, role-based access control, audit logging, and documented hardening procedures.

NSX, the networking component of VCF, delivers a hierarchical security policy framework organized around domains, security policies, and individual rules. Each rule can be configured with action, direction, IP protocol, source groups, destination groups, services, and scope, providing administrators a structured and repeatable model for defining network security posture. Security policies are organized into categories (Emergency, Infrastructure, Environment, Application) so that multiple administrators can create and manage policies without conflicts or overrides. Firewall rules within each category are organized into sections, supporting logical grouping and ordered evaluation. This hierarchical structure supports both centralized governance and delegated administration, allowing organizations to maintain consistent security standards while enabling application teams to manage policies within their assigned boundaries.

VCF's network security governance model is built on role-based access control (RBAC) that spans networking and security functions. NSX Projects and VPCs support scoped role assignments including VPC Admin, Security Admin, Network Admin, Security Operator, and Network Operator roles. These roles can be assigned at the project or VPC level, enabling least-privilege access to network security configuration. A VPC Admin has full access to networking and security objects within their assigned VPC, while Enterprise Admins retain overarching control. NSX Advanced Network Management extends RBAC to specific networking components including static routes, locale services, segments, segment profiles, IP address pools, forwarding policies, DNS, DHCP, load balancing, and NAT. This separation of duties allows organizations to delegate day-to-day network security operations while retaining centralized oversight.

The NSX VPC workflow provides a structured mechanism for implementing network security controls at the application level. Application owners can add subnets inside their assigned VPC and configure security policies to meet workload requirements without dependency on the Enterprise Admin. VPC Admins and Security Admins add security policies within the VPC to address the security requirements of connected workloads. Default East-West firewall rules are activated automatically when an appropriate security license is applied and can be adjusted as needed. This self-service model, bounded by RBAC, allows security policy implementation to scale across the organization while maintaining governance guardrails.

VCF includes multiple layers of network security controls. VMware vDefend, a separately licensed product that extends NSX, provides Distributed Firewall enforcement across deployment and operational scenarios, while its Gateway Firewall provides perimeter security. Context profiles and Layer 7 access profiles enable firewall rules with application-level and domain-based attributes for both distributed and gateway firewall enforcement. For containerized workloads, the Antrea Container Network Interface (CNI) plugin in VMware Kubernetes Service (VKS) enforces Kubernetes NetworkPolicy at the namespace and pod level. The AntreaPolicy feature gate enables AntreaNetworkPolicy and ClusterNetworkPolicy objects that extend standard NetworkPolicy with richer Layer 4 rule sets; traffic not explicitly permitted is blocked by default when a policy applies to a pod. The Antrea NetworkPolicyStats feature gate collects enforcement statistics, giving operators visibility into which policies are matching traffic and at what volume to support operational monitoring and periodic policy review. A Kubernetes cluster must provide and enforce NetworkPolicy for network security controls to be effective.

The VKS networking layer within VCF integrates directly with the broader NSX security framework. Supervisors using NSX VPC networking operate in the system VPC while VKS clusters reside in vSphere Namespace VPCs, providing topology-level isolation between the management plane and workload clusters. NSX VPC pod IP pools are configured as Private, restricting direct external accessibility of pod addresses. Antrea EgressSeparateSubnet allows egress traffic from specific workloads to originate from a subnet distinct from the default node subnet, supporting more granular traffic segmentation. The Network Control Plane (NCP) component bridges Kubernetes networking objects with NSX, realizing VirtualNetwork, VirtualNetworkInterface, and LoadBalancer resources for the VKS control plane; communication between Supervisor and NSX is secured using TLS. Kubernetes control plane services communicate using certificates by default, and connections from nodes and pods to the control plane are secured by default and can run over untrusted networks. Supervisor networking architecture requires a deliberate deployment-time choice: NSX with embedded load balancer, or vSphere Distributed Switch with external load balancer. This choice determines which network security mechanisms are available downstream, and organizational procedures should reflect which path is in use. VKS Cluster Management Custom Policies provide a governance mechanism that should be reviewed and updated to ensure policy logic reflects current security and operational requirements. The Argo CD Supervisor Service deployment implements network segmentation and firewall rules to secure communication between its components. Organizations operating service meshes alongside VKS gain OSI Layer 7 network policies based on workload identity and mutual TLS encryption for pod-to-pod traffic, providing an additional isolation layer beyond namespace boundaries.

At the virtual infrastructure layer, vSphere Distributed Switches provide centralized management of virtual networking, handling traffic for all associated hosts in a data center. Distributed switches support network segmentation using Private VLAN (PVLAN) and VLAN-based SPAN for distributed port mirroring. Network segmentation is built into the VCF architecture: management traffic, vMotion, and storage traffic are isolated on separate networks. Network I/O Control allocates bandwidth to traffic types based on share values, and the Storage Traffic Separation network profile creates dedicated vSphere Distributed Switches with separate physical NICs for storage traffic isolation. NSX distributed port groups and uplink port groups support Traffic Filtering and Marking policies configurable at the port level, providing additional granularity for layer 2 security controls. ESX hosts also support IPsec for VMkernel network communication, with security associations and policies configurable via esxcli network ip ipsec commands, supporting both transport and tunnel mode with upper layer protocol filtering for tcp, udp, icmp6, or any traffic.

vSphere Lifecycle Manager enforces desired-state configuration for hosts and clusters, applying and remediating configuration to match the defined software specification. This helps detect and address configuration drift that could weaken network security posture, and the remediation process can be managed programmatically through the vSphere Automation API.

VCF publishes security baselines through the Security Configuration Guide and DISA STIGs. The NSX Security Configuration Guide provides documented procedures for securing NSX components, including NSX nodes, NSX Controllers, and NSX Edge nodes. Recommendations cover configuring strong authentication, implementing RBAC, and securing administrative access. NSX security best practices address creating and managing security groups, implementing distributed firewalling, configuring security policies, and enforcing microsegmentation to control network traffic. Security Technical Implementation Guides for Supervisor and VMware Kubernetes Release (VKr) components are available to provide hardening guidance for VKS deployments, extending the documented security baseline to the containerized workload layer. These documented hardening procedures, aligned with industry-standard best practices, give organizations a baseline for developing and updating their network security control procedures.

Audit logging supports ongoing governance by recording security policy changes with full traceability. NSX firewall audit logs capture the user performing the operation, the module name, operation type, operation status, and modified resource details including the security policy display name, identifier, path, and rule configurations. This audit trail enables organizations to track who changed network security policies, what was changed, and when, supporting both compliance review and change management processes.

Programmatic management capabilities, including PowerCLI cmdlets such as InvokePatchSecurityPolicyForDomain for creating distributed firewall policies, support infrastructure-as-code approaches to network security governance, enabling version-controlled and repeatable policy deployment.",Meets,"VMware vDefend provides the technical enforcement layer that underlies Network Security Control (NSC) implementation, though the procedural and governance aspects of developing and updating NSC procedures remain organizational responsibilities.

Security Services Platform enables monitoring of traffic after publishing assets and security policies to NSX Manager, allowing administrators to refine policies and adjust security posture based on observed traffic behavior. Security Intelligence Policy Recommendations correlate observed traffic patterns within the NSX environment to assist with enforcing more dynamic security policies; these recommendations can be reviewed and published directly to the Distributed Firewall (DFW) rule set. The Security Intelligence infrastructure classification feature identifies compute entities providing network infrastructure services in the NSX environment, supporting structured policy development around infrastructure traffic categories.

Dynamic NSGroups enable DFW and Gateway Firewall (GFW) rules to update automatically as workloads are deployed or modified in the environment. Security Services Platform provides a workflow to import data center hierarchy from CSV, which translates IP addresses to virtual machines, tags those VMs, and creates NSX groups necessary for segmentation planning. This supports the initial development of network security control structures from existing IP-based inventories.

vDefend DFW security posture is applied to VPCs through system-defined Security Profiles accessible in NSX Manager. When a Security Profile is applied to a VPC in VCF Automation, the system automatically generates and realizes system-managed DFW rules within the NSX Project space. DFW policies extend to Bare Metal servers, with Bare Metal server groups, vDefend DFW policies, and rules defined in NSX Manager and managed through Security Services Platform. Malware Prevention Service is configured through the IDS/IPS & Malware Prevention Setup wizard, which provides a guided sequence of steps to prepare the data center.

NSX Federation Security provides centralized management of security policies across multiple sites through a Global Manager, supporting consistent policy enforcement in distributed and multi-site environments. The Security Overview dashboard in NSX Manager displays threat detection and response features, a visual summary of the overall security configuration, and the capacity of NSX objects, giving administrators visibility into the state of deployed network security controls.",Not Applicable,"End user activity or process, design decision, or activity out of scope.",Contributes,"VMware Data Services Manager (DSM) contributes to Network Security Controls implementation through its infrastructure policy framework, which governs how databases are placed on the network and which network resources they may access.

DSM's architecture requires that network connectivity be provided through vSphere Distributed Switches (VDS) or NSX Virtual Distributed Switches (N-VDS). During initial setup, administrators configure IP pools that define the address space available for database deployment. IP pools may be created either during infrastructure policy definition or in advance, with each pool specified using a Subnet Prefix in CIDR notation that controls network vs. host address allocation. The vSphere administrator is responsible for regulating database IP assignment through this mechanism, tying database network placement to explicitly defined, administrator-controlled address ranges rather than allowing ad-hoc assignment.

Infrastructure policies aggregate network configuration choices alongside compute and storage settings into named policies that govern how databases are provisioned. The DSM administrator UI provides an Infrastructure Policies view that displays all configured policies and their associated resources, including IP pools, VM classes, CPU, memory, and storage policies, giving administrators continuous visibility into how network resources are allocated across the environment. Defining infrastructure policies is advised to provide full visibility into infrastructure usage by DSM users.

DSM actively detects conflicting network configurations. When it detects overlap between Supervisor infrastructure policy IP ranges and system configuration networks, it generates a NetworkOverlapFound alert and requires resolution before provisioning operations can proceed. Infrastructure policies should be updated to remove overlapping networks that may cause provisioning failures.

DSM supports custom certificate management for the Provider VM, including an IP-inclusive certificate style where the Subject Alternative Name can list one or more IP addresses and optionally FQDNs, aligning certificate identity with the addresses assigned through IP pool management. For SQL Server databases, administrators can specify the allowed TLS versions for client connections using the network.tlsProtocols custom engine setting in the data service policy.

DSM is a database-as-a-service platform rather than a dedicated network security tool. It does not provide firewalls, intrusion detection, or network traffic inspection; those capabilities are provided by VMware vDefend, which is a separate product. Developing and updating organizational procedures for network security controls is an organizational responsibility that DSM does not fulfill. The network isolation and address management controls DSM exposes are implemented through the underlying VCF platform infrastructure, and the broader NSC governance framework must be established by the organization.",Contributes,"VMware Avi Load Balancer provides application-layer network security policy mechanisms that help organizations implement network access controls at the application delivery boundary. These Avi-native capabilities operate at the Virtual Service level and give administrators structured objects for defining, governing, and updating access rules as requirements change.

Avi's Network Security Policy evaluates incoming client traffic based on network-level parameters and determines whether a connection should be accepted, discarded, or rate-limited. IP Group-based access control lists applied per Virtual Service are the most scalable method for implementing network-layer ACLs, allowing administrators to specify which source addresses may reach individual application services. Policies can be created and modified through the Avi Controller CLI using the configure networksecuritypolicy command, and updated programmatically through the REST API using the Modify Network Security ACL endpoint and IP Group UUID references.

Starting with Avi Load Balancer version 32.1, NSX security groups can be used directly in both HTTP Policies and Network policies. Security groups defined once in NSX are reused across Avi Virtual Service security policies, removing the need to manually maintain IP address lists in Avi. When an IP address changes in NSX, the update propagates automatically to Avi Load Balancer, keeping Virtual Service security policies current without manual intervention. This integration provides a unified governance model where network security group membership is managed centrally in NSX and reflected automatically in Avi policy enforcement.

Avi's DDoS Policy detects and mitigates Layer 4 through Layer 7 network attacks through the Network Security policy framework, providing additional network security control at the application delivery layer.

Within the broader VCF platform, NSX provides underlay routing and network infrastructure for Avi Service Engines. East-west firewall enforcement between application tiers is provided by VMware vDefend, a separate product that extends the platform's network security posture beyond what Avi provides at the application proxy boundary.

Satisfying this control fully requires the organization to document procedures for governing and updating network security controls across the Avi tier and the broader platform, assign ownership of Avi policy objects, and establish change management processes covering both Avi Network Security Policies and VCF-layer controls."
