Control ID,SCF ID,Description,Control Coverage,Response
3.7,"CRY-09, OPS-01.1","3.7 Where cryptography is used to protect stored account data, key management processes and procedures covering all aspects of the key lifecycle are defined and implemented.",Contributes,"VMware Cloud Foundation provides comprehensive cryptographic key management controls, safeguarding the confidentiality, integrity, and availability of keys through multiple mechanisms. The platform integrates with KMIP 1.1-compatible Key Management Servers (KMS) or the vSphere Native Key Provider (NKP), establishing a cryptographic domain of trust between key providers, vCenter, and ESX hosts.

A three-tier key hierarchy is employed, where Key Encryption Keys (KEK) wrap Disk Encryption Keys (DEK, with optional wrapping keys for KEKs), enabling efficient key rotation or revocation without re-encryption of underlying data. Automatic key rotation is configurable with intervals ranging from 30 days to 10 years.

Fine-grained Cryptographic Operations privileges in vCenter, including a ""No Cryptography Administrator"" role, enforce separation of duties, allowing for custom roles to restrict specific key management actions. The vSphere API exposes a CryptoManager managed object hierarchy, facilitating programmatic key lifecycle management over mutually authenticated TLS channels.

VMware Live Recovery extends these capabilities to disaster recovery scenarios, ensuring key availability, consistency, and coordination across protected and recovery sites by requiring shared KMS infrastructure or common encryption keys registered with identical names.

VMware vDefend further contributes by managing certificate lifecycle and service-specific key pairs for its distributed security services, including automated certificate management via cert-manager and configurable key pair strategies for malware prevention components, addressing the key material vDefend itself generates, consumes, and rotates.

While the platform provides the robust technical mechanisms and tools for managing cryptographic keys throughout their lifecycle, the organization remains responsible for defining and implementing the overarching key management processes and procedures. This includes establishing specific policies for key generation, storage, distribution, use, rotation, revocation, and destruction, as well as configuring the integrated key management systems, assigning appropriate roles and privileges, and ensuring the secure storage of private keys where applicable. The platform provides the capabilities; the customer must operationalize them through documented processes and assigned accountability."
3.7.1,"GOV-02, CRY-09, OPS-01.1",3.7.1 Key-management policies and procedures are implemented to include generation of strong cryptographic keys used to protect stored account data.,Contributes,"VMware Cloud Foundation provides comprehensive cryptographic key management controls, ensuring the confidentiality, integrity, and availability of keys. This includes integration with KMIP 1.1-compatible Key Management Servers or the vSphere Native Key Provider, establishing a cryptographic domain of trust, and employing a three-tier key hierarchy (Key Encryption Keys wrapping Disk Encryption Keys) with configurable automatic key rotation intervals from 30 days to 10 years.

Fine-grained Cryptographic Operations privileges in vCenter, along with the No Cryptography Administrator role, enforce separation of duties for key management actions. The vSphere API further enables programmatic key lifecycle management, with all key operations secured over mutually authenticated TLS channels.

VMware Live Recovery extends these capabilities to disaster recovery scenarios by requiring common KMS infrastructure or shared encryption keys across protected and recovery sites, ensuring key availability and consistency for encrypted virtual machine protection and recovery.

VMware vDefend contributes by managing certificate lifecycle and service-specific key pairs for its internal security services, including automated certificate management via cert-manager and configurable key pair scope for malware prevention components.

While the platform provides robust technical mechanisms for the generation and management of strong cryptographic keys, the organization remains responsible for defining and implementing the overarching key-management policies and procedures. This includes establishing specific key generation standards, defining key rotation schedules within the platform's configurable ranges, formalizing separation of duties, and documenting the operational procedures for key lifecycle management to meet their specific compliance requirements."
3.7.2,"GOV-02, CRY-09, OPS-01.1",3.7.2 Key-management policies and procedures are implemented to include secure distribution of cryptographic keys used to protect stored account data.,Contributes,"VMware Cloud Foundation implements comprehensive cryptographic key management controls that ensure the secure distribution, storage, and lifecycle management of keys.
The platform integrates with KMIP 1.1-compatible Key Management Servers (KMS) or the vSphere Native Key Provider (NKP), establishing a cryptographic domain of trust between key providers, vCenter, and ESX hosts to restrict key access to authorized components.

A three-tier key hierarchy (KEK wrapping DEK) with optional higher-level wrapping keys provides layered protection and simplifies key rotation or revocation without re-encryption of underlying data, with automatic rotation configurable from 30 days to 10 years.

Fine-grained Cryptographic Operations privileges in vCenter, including the ""No Cryptography Administrator"" role, enforce separation of duties, while the vSphere API enables programmatic key lifecycle management. All key operations are secured over mutually authenticated TLS channels.

VMware Live Recovery extends these capabilities to disaster recovery scenarios by requiring shared KMS or common encryption keys across protected and recovery sites, with consistent KMS registration names. This ensures key availability and consistency, as VM recovery fails if encryption keys are not present at the recovery site, thereby enforcing secure key distribution across the DR environment.
vSphere Replication applies identical key coordination requirements.

VMware vDefend further contributes by managing its own certificate lifecycle and service-specific public-private key pairs within the Security Services Platform and Malware Prevention components, securing inter-component communication and providing control over key deployment scope.

While the platform provides robust technical mechanisms for secure key management and distribution, the organization is responsible for defining and implementing the overarching key-management policies and procedures, including those specifically addressing the secure distribution of cryptographic keys used to protect stored account data."
3.7.3,"GOV-02, CRY-09, OPS-01.1",3.7.3 Key-management policies and procedures are implemented to include secure storage of cryptographic keys used to protect stored account data.,Contributes,"VMware Cloud Foundation provides comprehensive cryptographic key management capabilities, integrating with KMIP 1.1-compatible Key Management Servers or the vSphere Native Key Provider to ensure secure storage of cryptographic keys. It establishes a cryptographic domain of trust, employs a three-tier key hierarchy (Key Encryption Keys wrapping Disk Encryption Keys) with configurable automatic key rotation intervals from 30 days to 10 years, and offers fine-grained access controls through vCenter privileges and roles such as the No Cryptography Administrator, enforcing separation of duties. The vSphere API enables programmatic key lifecycle management, with all key operations secured via mutually authenticated TLS channels. VMware Live Recovery extends these capabilities to disaster recovery scenarios, ensuring key availability and consistency across protected and recovery sites by requiring shared KMS infrastructure or common encryption keys, with VM recovery failing if keys are unavailable. VMware vDefend further contributes by managing the lifecycle of certificates and service-specific key pairs essential for its distributed security services, including automated certificate management and secure storage of private keys for malware prevention components.

The organization is responsible for defining, documenting, and implementing comprehensive key-management policies and procedures that leverage these platform capabilities. This includes establishing specific key rotation schedules, defining roles and responsibilities for key administrators, and ensuring that these policies align with the secure storage of cryptographic keys used to protect stored account data across the environment."
3.7.4,CRY-09,"3.7.4 Key management policies and procedures are implemented for cryptographic key changes for keys that have reached the end of their cryptoperiod, as defined by the associated application vendor or key owner, and based on industry best practices and guidelines, including the following:
 • A defined cryptoperiod for each key type in use.
 • A process for key changes at the end of the defined cryptoperiod.",Contributes,"VMware Cloud Foundation provides comprehensive cryptographic key management capabilities, integrating with KMIP 1.1-compatible Key Management Servers or the vSphere Native Key Provider to establish a secure cryptographic domain of trust. The platform employs a three-tier key hierarchy, where Key Encryption Keys (KEK) wrap Disk Encryption Keys (DEK, with optional wrapping keys for KEKs), allowing for efficient key rotation or revocation without re-encrypting underlying data. VCF supports configurable automatic key rotation with intervals ranging from 30 days to 10 years, directly enabling the enforcement of defined cryptoperiods. Fine-grained cryptographic operation privileges and the No Cryptography Administrator role facilitate separation of duties, while the vSphere API offers programmatic key lifecycle management over mutually authenticated TLS channels. VMware Live Recovery extends these capabilities to disaster recovery, requiring shared or consistent Key Management Servers and common encryption keys across protected and recovery sites to ensure key availability and consistency for encrypted virtual machines during failover and replication. VMware vDefend further contributes by managing its own service-specific certificates and key pairs, including automated certificate lifecycle management via cert-manager for the Security Services Platform and configurable key pair management for Distributed Malware Prevention, ensuring secure internal communications and operations.

While the platform provides the robust technical mechanisms for key rotation and lifecycle management, the organization is responsible for formally defining the cryptoperiod for each key type in use, establishing comprehensive key management policies and procedures, and implementing the overarching process for key changes at the end of the defined cryptoperiod. This includes documenting the chosen rotation intervals, defining roles and responsibilities, and ensuring adherence to industry best practices and guidelines."
3.7.5,"GOV-02, CRY-04, CRY-09, CRY-09.3, OPS-01.1","3.7.5 Key management policies procedures are implemented to include the retirement, replacement, or destruction of keys used to protect stored account data, as deemed necessary when: 
 • The key has reached the end of its defined cryptoperiod.
 • The integrity of the key has been weakened, including when personnel with knowledge of a cleartext key component leaves the company, or the role for which the key component was known.
 • The key is suspected of or known to be compromised. 
 Retired or replaced keys are not used for encryption operations.
 Applicability Notes
 If retired or replaced cryptographic keys need to be retained, these keys must be securely archived (for example, by using a key-encryption key).",Contributes,"VMware Cloud Foundation provides robust cryptographic key management capabilities that enable the retirement, replacement, and destruction of keys. It integrates with KMIP 1.1-compatible Key Management Servers (KMS) or the vSphere Native Key Provider (NKP) for secure key storage and lifecycle management. Automatic key rotation is configurable, allowing for key replacement at defined cryptoperiods. The vSphere API exposes a CryptoManager managed object hierarchy with methods for adding, listing, and removing keys, facilitating programmatic key lifecycle management. Fine-grained Cryptographic Operations privileges in vCenter, including the No Cryptography Administrator role, enforce separation of duties for key management actions. VMware Live Recovery extends these capabilities by ensuring key availability and consistency across protected and recovery sites for encrypted virtual machines, requiring common KMS or encryption keys. VMware vDefend manages its own internal service-specific key pairs and certificates, providing lifecycle management for these components.

The organization is responsible for defining and implementing comprehensive key management policies and procedures that specify the cryptoperiods for keys, criteria for assessing weakened key integrity (such as personnel changes), and processes for responding to suspected or known key compromises. These policies must govern the retirement, replacement, and destruction of keys, ensuring that retired or replaced keys are not used for new encryption operations. Furthermore, the organization must establish and implement secure archiving procedures for any cryptographic keys that need to be retained after retirement or replacement."
3.7.6,"GOV-02, CRY-09, OPS-01.1","3.7.6 Where manual cleartext cryptographic key-management operations are performed by personnel, key-management policies and procedures are implemented including managing these operations using split knowledge and dual control. 
 Applicability Notes
 This control is applicable for manual key-management operations. 
 A cryptographic key that is simply split into two parts does not meet this requirement. Secret or private keys stored as key components or key shares must be generated via one of the following: 
 • Using an approved random number generator and within a secure cryptographic device (SCD), such as a hardware security module (HSM) or PTS-approved point-of-interaction device, 
 OR
 • According to ISO 19592 or equivalent industry standard for generation of secret key shares.",Contributes,"VMware Cloud Foundation provides robust, automated cryptographic key management capabilities designed to minimize or eliminate the need for manual cleartext key operations. VCF integrates with KMIP 1.1-compatible Key Management Servers (KMS) or the vSphere Native Key Provider, establishing a cryptographic domain of trust.

Keys are managed through a three-tier hierarchy, with automatic rotation configurable at defined intervals. All key operations are performed programmatically via the vSphere API over mutually authenticated TLS channels. The platform enforces separation of duties for cryptographic operations privileges within vCenter through fine-grained roles, including a ""No Cryptography Administrator"" role, which restricts who can perform key management actions. Integration with KMS, often implemented as Hardware Security Modules (HSMs), ensures that keys, including any components or shares, are generated using approved random number generators within secure cryptographic devices, aligning with industry standards.

VMware Live Recovery extends these secure key management practices to disaster recovery scenarios. It requires that protected and recovery sites share a common Key Management Server or common encryption keys, with KMS clusters registered consistently across sites. This ensures key availability and consistency for encrypted virtual machines during replication and recovery, without introducing manual cleartext operations.

VMware vDefend further contributes by managing its own certificate lifecycle and service-specific public-private key pairs within the Security Services Platform and Malware Prevention components. It utilizes automated certificate lifecycle management and provides controls for secure storage of private keys, relying on the underlying VCF platform for broader enterprise key management functions.

While the platform's architecture and capabilities significantly reduce the necessity for manual cleartext cryptographic key-management operations, the organization remains responsible for implementing comprehensive key-management policies and procedures.

These policies must explicitly address any manual cleartext operations that may occur within their broader environment, ensuring they are managed using split knowledge and dual control principles. The customer must also define processes for personnel involved in such operations and ensure that any secret or private key components or shares are generated according to ISO 19592 or within secure cryptographic devices."
3.7.7,"GOV-02, CRY-09, OPS-01.1",3.7.7 Key management policies and procedures are implemented to include the prevention of unauthorized substitution of cryptographic keys.,Contributes,"VMware Cloud Foundation provides comprehensive cryptographic key management controls that protect the confidentiality, integrity, and availability of keys. The platform integrates with KMIP 1.1-compatible Key Management Servers or the vSphere Native Key Provider, establishing a cryptographic domain of trust between key providers, vCenter, and ESX hosts. This architecture ensures keys are only accessible to authorized components, directly preventing unauthorized substitution.

VCF employs a three-tier key hierarchy with configurable automatic key rotation intervals ranging from 30 days to 10 years. Fine-grained Cryptographic Operations privileges in vCenter, including the ""No Cryptography Administrator"" role, enforce separation of duties and control who can perform specific key management actions, further mitigating risks of unauthorized key manipulation. All key operations are conducted over mutually authenticated TLS channels.

VMware Live Recovery extends these capabilities to disaster recovery scenarios by requiring consistent key management server registration and common encryption keys across protected and recovery sites, ensuring the integrity and availability of cryptographic keys are maintained during failover and failback operations.

VMware vDefend contributes by managing its own internal certificate lifecycle and service-specific key pairs, securing communication within its distributed security services and providing controls for certificate export, CSR generation, and key pair management for malware prevention.

While the platform provides robust technical mechanisms to prevent unauthorized substitution of cryptographic keys, the organization is responsible for defining and implementing the overarching key management policies and procedures. This includes establishing specific administrative roles, configuring key rotation schedules, defining key lifecycle management processes, and ensuring these policies are consistently applied across the environment to fully leverage the platform's capabilities."
3.7.8,"GOV-02, HRS-03, OPS-01.1",3.7.8 Key management policies and procedures are implemented to include that cryptographic key custodians formally acknowledge (in writing or electronically) that they understand and accept their key-custodian responsibilities.,Not Applicable,"End user activity or process, design decision, or activity out of scope."
3.7.9,CRY-09.6,"3.7.9 Additional requirement for service providers only: Where a service provider shares cryptographic keys with its customers for transmission or storage of account data, guidance on secure transmission, storage and updating of such keys is documented and distributed to the service provider's customers.
 Applicability Notes
 This requirement applies only when the entity being assessed is a service provider.",Contributes,"VMware Cloud Foundation provides foundational capabilities and comprehensive documentation that inform secure cryptographic key management and sharing practices. The platform supports integration with KMIP 1.1-compatible external Key Management Servers (KMS) and the vSphere Native Key Provider, detailing the architecture, configuration practices, and trust establishment processes, including certificate exchange and explicit trust configuration. VCF's documentation covers essential aspects such as permission requirements for key management operations (e.g., Cryptographer.ManageEncryptionPolicy), key lifecycle considerations for virtual machine and disk encryption, and guidance on protecting sensitive key material like host keys. Technical procedures for key sharing scenarios, such as encrypted Cross-vCenter vMotion, are documented, specifying the need for matching key provider configurations.

VMware Live Recovery further extends this by documenting key management requirements for disaster recovery environments, explicitly guiding customers on the configuration of common Key Management Servers or common encryption keys across protected and recovery sites for encrypted virtual machine replication. This includes KMS configuration requirements, vSphere Native Key Provider setup at both sites, and certificate exchange processes for site pairing, along with specific certificate requirements for custom SSL/TLS certificates.

While VMware Cloud Foundation and VMware Live Recovery provide extensive technical documentation and capabilities that are critical for secure key management and sharing, the broader responsibility of compiling, documenting, and distributing comprehensive key management guidance to the service provider's customers for all shared cryptographic keys remains an organizational documentation and service delivery activity. This overarching responsibility extends beyond the inherent technical delivery and product documentation provided by the platform."
4.1,NET-12,4.1 Processes and mechanisms for performing activities in Requirement 4 are defined and understood.,Contributes,"VMware Cloud Foundation (VCF) provides comprehensive and robust mechanisms for data protection and cryptographic operations, supporting modern cryptographic standards with formal validation of cryptographic libraries via FIPS 140-3. All cryptographic operations utilize FIPS 140-3 validated modules.

Data-in-transit network communications for system management are encrypted by default using standardized cipher suites, with TLS 1.3 as the default and TLS 1.2 for compatibility. vSAN offers data-in-transit encryption capabilities, and Encrypted vSphere vMotion secures confidentiality, integrity, and authenticity of data during VM migrations. VMware Live Recovery protects data transmitted over networks through mandatory encryption, with all communications between VLR and vCenter instances occurring over TLS connections, and vSphere Replication encrypts replication traffic between sites. NSX Edge IPSec VPN uses standard cryptography schemes, and VCF Operations for Networks can restrict connections to FIPS-validated cryptographic modules by enabling FIPS mode.

Data-at-rest encryption is implemented via vSAN cluster-based encryption or VM Encryption, leveraging AES-NI CPU offloading and managed through KMIP 1.1-compatible external Key Management Servers (KMS) or vSphere Native Key Provider (NKP), establishing a three-element domain of trust. Memory Tiering encryption protects tiered memory without requiring external key management. ESX stores configuration data in encrypted form on boot devices, leveraging TPM 2.0 for key protection.

PKI keypair and certificate options are highly customizable, ranging from fully automated within VCF to integration with enterprise PKI infrastructure, with centralized certificate lifecycle management for all VCF components. VCF implements key management through integration with KMIP 1.1-compatible KMS or the built-in vSphere Native Key Provider, establishing a cryptographic domain of trust and supporting a three-tier key hierarchy with automatic key rotation.

VCF supports guest-level security features such as virtual Trusted Platform Module (vTPM) 2.0 and Secure Boot for VMs. vSAN includes secure disk wipe capabilities per NIST 800-88 standards, and VCF maintains separation between encryption configuration and routine operations through roles like the No Cryptography Administrator. VMware vDefend Security Intelligence identifies risky application protocols that transmit data in cleartext and provides TLS inspection capability for encrypted traffic.

While VCF, VMware Live Recovery, and vDefend deliver the advanced technical mechanisms for data protection and cryptographic operations, the organization is responsible for defining and documenting the specific processes and procedures for implementing, configuring, managing, and monitoring these capabilities. This includes establishing clear operational guidelines for certificate lifecycle management, key management, encryption policy enforcement, and responding to security intelligence findings to ensure these mechanisms are consistently and effectively utilized and understood across the environment."
4.1.1,"GOV-02, GOV-03, OPS-01, OPS-01.1","4.1.1 All security policies and operational procedures that are identified in Requirement 4 are:
 • Documented
 • Kept up to date
 • In use
 • Known to all affected parties",Not Applicable,"End user activity or process, design decision, or activity out of scope."
