Control ID,SCF ID,Description,Control Coverage,Response
8.2.5,"HRS-09, HRS-09.2, IAC-07.1, IAC-07.2, IAC-20.6",8.2.5 Access for terminated users is immediately revoked,Contributes,"VMware Cloud Foundation (VCF) provides robust technical mechanisms to ensure immediate revocation of logical access for terminated users. Through its centralized identity management, VCF SSO integrates with enterprise identity providers such as Active Directory and LDAP. Disabling or removing a user account in the connected identity source immediately prevents authentication across all VCF components, including vCenter, SDDC Manager, and NSX Manager. This single administrative action at the directory level effectively revokes access across the entire platform.

VCF also offers direct administrative controls within its components, allowing system administrators to deactivate or delete user accounts, revoke individual access tokens, and modify role-based access control (RBAC) assignments. Changes to roles or group memberships are reflected immediately, ensuring that privileges align with current authorization.

Furthermore, VCF Automation enforces deployment lease policies that automatically terminate resource access after expiration, providing an additional safeguard.

VMware vDefend complements these capabilities by enforcing immediate network-level access revocation. Its Distributed Firewall and Gateway Firewall policies can be updated instantly to deny network connectivity for specific users or workloads. The vDefend Identity Firewall integrates with Active Directory, dynamically adjusting network access based on changes to AD group memberships. Microsegmentation policies offer fine-grained control, allowing immediate isolation of workloads or denial of traffic flows upon revocation.

While VCF and vDefend provide the technical enforcement for immediate access revocation, the customer is responsible for establishing and executing the organizational processes that identify terminated users and trigger these technical actions. This includes managing the lifecycle of user accounts within the enterprise identity provider and initiating the necessary administrative steps.

Physical access revocation remains outside the scope of the VCF platform and requires separate facility management processes."
8.2.6,IAC-15.3,8.2.6 Inactive user accounts are removed or disabled within 90 days of inactivity.,Contributes,"VMware Cloud Foundation provides robust capabilities for managing user account states across its components. Within VCF Automation, administrators can disable user accounts and groups through the Access Control interface, preventing login while retaining the account for potential reactivation. Accounts can also be permanently deleted when no longer required. VCF Operations offers similar controls, allowing administrators to deactivate user accounts via an 'Activated' field or disable checkbox, thereby restricting access to VCF Operations features. NSX Manager further supports the activation and deactivation of local user accounts, with Enterprise Admins able to manage these states, including default inactive guest accounts.

While VCF offers comprehensive manual controls for account state management, it does not include a native, built-in automated timer to disable or remove accounts based on a defined period of inactivity. Organizations are responsible for implementing time-based inactivity policies, typically through integration with an external directory service such as Active Directory, LDAP, or an OIDC provider. These external directory services can enforce automated inactivity policies that flow through to VCF access, complementing the platform's direct account management capabilities."
8.2.7,"MNT-05, MNT-05.1, MNT-05.4, NET-14, NET-14.6","8.2.7 Accounts used by third parties to access, support, or maintain system components via remote access are managed as follows:
 • Enabled only during the time period needed and disabled when not in use.
 • Use is monitored for unexpected activity.",Contributes,"VMware Cloud Foundation (VCF) provides robust mechanisms for managing and monitoring third-party accounts used for remote access. VCF integrates with external identity providers through VCF SSO, supporting identity federation with enterprise authentication systems like Active Directory or LDAP. User accounts can be imported and assigned granular roles via VCF Access Control, which enforces role-based access control (RBAC) across all VCF components, including vCenter, NSX, and SDDC Manager. VCF Automation further supports service accounts for automated third-party application access. VMware Live Site Recovery (VLR) leverages VCF SSO for authenticating remote maintenance access to its appliance management interface and vSphere Client plug-in. VMware vDefend contributes by enforcing network-level controls through the Distributed Firewall, restricting external or third-party access to internal systems based on least-privilege segmentation rules.

VCF, VLR, and vDefend collectively provide comprehensive monitoring capabilities for third-party account usage. VCF Operations captures platform interactions through its audit events framework, logging user logins, logouts, configuration modifications, and capability checks across vSphere, vSAN, and NSX resources. These audit logs, including NSX CLI logs and VCF Automation audit logs, are tied to authenticated user identities via centralized RBAC and VCF SSO, providing a complete trail of actions. VCF Operations can forward these logs to external syslog servers for centralized security auditing. VLR audits remote maintenance activities through its event logging system, recording configuration changes and DR operations with timestamps and user attribution, and provides session management logging. vDefend supports log forwarding to a remote syslog server and includes a Remote Services detector within its IDS/IPS capabilities to identify suspicious behavior associated with remote connection protocols, while Security Intelligence monitors for anomalous remote access behavior.

While VCF provides the identity integration, RBAC framework, and extensive audit trails, the proactive lifecycle management of third-party accounts, including their time-bound enablement and disablement when not in use, requires organizational processes and potentially a dedicated Privileged Access Management (PAM) solution. The continuous monitoring of user security aspects to detect risks and verify appropriate access levels also remains an operational responsibility of the customer."
8.2.8,"IAC-14, IAC-24, IAC-25, NET-07","8.2.8 If a user session has been idle for more than 15 minutes, the user is required to re-authenticate to re-activate the terminal or session.
 Applicability Notes
 This requirement is not intended to apply to user accounts on point-of-sale terminals that have access to only one card number at a time to facilitate a single transaction.
 This requirement is not meant to prevent legitimate activities from being performed while the console/PC is unattended.",Contributes,"VMware Cloud Foundation (VCF) provides robust mechanisms for managing user session inactivity and enforcing re-authentication across its management interfaces.

VCF components, including vCenter, NSX Manager, VCF Automation, and VCF Operations for Networks, support configurable session timeouts that automatically terminate idle user sessions. For instance, VCF Operations for Networks defaults to a 15-minute user session timeout, and NSX Manager sessions expire after 30 minutes of inactivity by default, both of which are adjustable.

When a session terminates due to inactivity, the associated authentication token is invalidated, requiring the user to re-authenticate to regain access. The vSphere Web Services API and PowerCLI sessions also offer configurable timeout durations and explicit logout methods, ensuring that API-based access sessions can be managed and terminated programmatically. VCF's Single Sign-On (SSO) integration issues time-limited authentication tokens that necessitate re-authentication upon expiration, further contributing to session security.

VMware vDefend complements these management plane controls by providing configurable session timers and connection state management for workload network traffic.

The vDefend Distributed Firewall maintains session state for all connections and applies configurable timers that terminate network connections after periods of inactivity. These timers operate at the vNIC level on every ESXi host, governing workload-to-workload connections.

When a session timer expires, the firewall removes the connection entry, effectively terminating the session and logging the reason. Granular TCP timer controls, including Closing and FIN timeouts, are configurable through session timer profiles, allowing organizations to align timeout behavior with specific workload requirements and security policies.

While VCF and vDefend provide the essential technical capabilities for session termination and re-authentication, the specific policy decisions, including the exact 15-minute inactivity threshold and the overall re-authentication strategy, remain an organizational responsibility. Customers must configure the session timeout values across VCF components to align with their defined security policies. Furthermore, VCF terminates idle sessions rather than locking them; therefore, organizations must implement workstation-level screen lock policies to address the ""terminal"" aspect of the control and ensure comprehensive protection when consoles or PCs are unattended."
8.3,"IAC-02, IAC-10, IAC-10.1",8.3 Strong authentication for users and administrators is established and managed.,Contributes,"The platform provides a robust, centralized authentication, authorization, and auditing (AAA) model through VCF SSO, which acts as the identity broker for all VCF components including vCenter, ESX, NSX, SDDC Manager, VCF Operations, and VCF Automation. All user and service authentication flows through VCF SSO, issuing SAML tokens and supporting identity federation with enterprise identity providers via SAML or OIDC. This federation enables multifactor authentication (MFA) and automated user lifecycle management, with the Authorization Code grant type in VMware Identity Broker specifically supporting MFA workflows.

For local accounts, VCF components enforce stringent password complexity, length, and lifespan requirements. NSX Manager mandates a minimum of 12 characters with diverse character types and a configurable 90-day expiration, while VCF Operations enforces a minimum of 15 characters with similar complexity and configurable account lockout. VCF Automation also supports account lockout.

Service-to-service authentication utilizes certificate-based Principal Identity users and API access tokens, eliminating password credentials. SDDC Manager provides centralized certificate lifecycle management, integrating with external CAs, and supports non-disruptive certificate rotation. SDDC Manager also offers centralized password lifecycle management for VCF components, enabling on-demand or scheduled rotation with randomized, policy-compliant passwords and automatic re-establishment of integrations.

VMware vDefend enforces strong authentication for its management plane, supporting local user accounts and integration with directory services like Active Directory over LDAPS. The Security Services Platform (SSP) mandates a minimum of 12 characters with diverse character types for local user passwords, valid for 180 days, with notifications prior to expiration. NSX Manager and NSX Edge, which manage vDefend firewall policies, enforce similar stringent password complexity, length, and expiration policies, including restrictions against dictionary words and monotonic sequences. Integration with enterprise directory services allows organizations to extend their existing password policies to vDefend administrative access.

While the platform provides comprehensive technical controls for strong authentication, authenticator strength, complexity, expiration, and rotation within its components, the broader organizational policies governing identity governance, identity provider infrastructure management, role assignment procedures, and authenticator management across all enterprise systems remain the responsibility of the customer."
8.3.1,"IAC-10, IAC-10.1, IAC-10.2","8.3.1 All user access to system components for users and administrators is authenticated via at least one of the following authentication factors:
 • Something you know, such as a password or passphrase.
 • Something you have, such as a token device or smart card.
 • Something you are, such as a biometric element.
 Applicability Notes
 This requirement is not intended to apply to user accounts on point-of-sale terminals that have access to only one card number at a time to facilitate a single transaction.
 This requirement does not supersede multi-factor authentication (MFA) requirements but applies to those in-scope systems not otherwise subject to MFA requirements.
 A digital certificate is a valid option for “something you have” if it is unique for a particular user.",Contributes,"VMware Cloud Foundation (VCF) ensures that all user and administrator access to its system components is authenticated using at least one robust factor. VCF enforces stringent password complexity, length, and lifespan requirements across all platform components, including NSX Manager, NSX Edge, VCF Operations, and VCF Automation. For instance, NSX Manager mandates passwords of at least 12 characters with diverse character types and a 90-day expiration, while VCF Operations requires a minimum of 15 characters with similar complexity and account lockout policies. SDDC Manager centralizes password lifecycle management, enabling on-demand or scheduled rotation of randomized passwords that adhere to component-specific policies. VCF SSO further supports federation with enterprise identity providers, allowing the application of organizational password policies and enabling token-based authentication.

Beyond passwords, VCF extensively utilizes digital certificates as a ""something you have"" authentication factor. Solution users, facilitating service-to-service communication between VCF components, authenticate using certificates, with the platform validating the certificate chain for each connection. VCF components validate certificates by constructing and verifying certification paths to trusted anchors during TLS communication and authentication. VCF includes the VMware Certificate Authority (VMCA), which can operate as a subordinate CA to an enterprise PKI, establishing verifiable certification paths. VMware vDefend and VMware Live Recovery similarly leverage PKI-based authentication. vDefend's Security Services Platform (SSP) maintains its own certificate hierarchy for component authentication and secures connections to external identity providers, while its NDR Sensor uses PKIX certificate path validation. VMware Live Recovery uses PKI-based authentication for site pairing and appliance management, verifying certificates during configuration and securing replication channels with certificate-based authentication.

While VCF, vDefend, and VLR provide the technical controls for enforcing strong password policies and utilizing certificate-based authentication for various access types, the broader organizational policies governing authenticator lifecycle management, including specific password policy parameters, certificate revocation checking (CRL/OCSP), and integration with external certificate authorities, remain the responsibility of the customer. The customer must define and implement these overarching policies and processes to ensure comprehensive authenticator management across their entire environment."
8.3.2,"CFG-02, CRY-01, CRY-03, CRY-05",8.3.2 Strong cryptography is used to render all authentication factors unreadable during transmission and storage on all system components.,Meets,"VMware Cloud Foundation (VCF) inherently employs strong cryptography to protect authentication factors during transmission and storage across its core components. All VCF components utilize FIPS 140-3 validated cryptographic modules. Internal VCF communications, including those involving authentication, default to TLS 1.3, with TLS 1.2 as a compatibility fallback, and all system management network communications are encrypted by default using standardized cipher suites. ESX hosts store configuration data, which includes authentication-related information, in encrypted form on boot devices, with the encryption key protected by TPM 2.0 when enabled. VCF Operations provides centralized certificate lifecycle management, supporting automated renewal and replacement for secure trust establishment.

This cryptographic protection extends to authentication for specific services and workloads. Secure LDAPS connections for platform authentication are supported through certificate validation. VMware Live Recovery (VLR) ensures all communications with vCenter instances occur over TLS connections, and site pairing uses certificate-based trust establishment. VMware vDefend secures inter-component communications using TLS 1.2 with approved cipher suites (e.g., AES-GCM, ECDHE) and encrypts its stored data using AES 256-bit. For virtual machines, VCF's vSAN cluster-based encryption and VM Encryption protect data at rest, including any authentication factors stored within VMs, across all datastore types. Encrypted vSphere vMotion further secures authentication-related data during live migrations by using one-time keys for each session.

While the platform provides robust cryptographic mechanisms, customers are responsible for configuring and enforcing these capabilities according to their organizational security policies. This includes managing external Key Management Servers (KMS) or configuring the Native Key Provider, ensuring appropriate VM encryption policies are applied, and maintaining the security of any guest-level authentication factors through in-guest encryption or other operating system-native features. Customers must also ensure that any third-party applications or custom solutions deployed on VCF adhere to strong cryptographic practices for their authentication factors."
8.3.3,"IAC-01, IAC-02, IAC-10, IAC-10.1, IAC-28",8.3.3 User identity is verified before modifying any authentication factor.,Meets,"VMware Cloud Foundation (VCF) verifies user identity before issuing authenticators or modifying access permissions through its centralized VCF SSO service. All user authentication flows through VCF SSO, which validates identity against configured identity sources, ensuring identity verification occurs through trusted sources before authentication tokens or permissions are provisioned. Permissions on managed objects can only be set or updated through the AuthorizationManager API after the calling user has been authenticated. VCF supports federation with external identity providers using SAML or OIDC, enabling multifactor authentication and automatic account synchronization, which strengthens identity verification before credentials are issued. VCF Operations audit reports capture authentication events, providing traceability of identity validation actions. VCF also provides built-in capabilities for managing authenticators, including centralized password lifecycle management through SDDC Manager for VCF components and certificate lifecycle management for service-to-service authentication.

VMware vDefend's Security Services Platform supports authentication for its own management plane using local user accounts or directory-managed accounts, enforcing password complexity, length, and lifespan requirements for administrative access to its security functions.

While VCF provides the technical mechanisms for identity verification prior to authenticator modification, the broader organizational processes for defining identity governance policies, managing identity provider infrastructure, and establishing role assignment procedures remain customer responsibilities. For vDefend, while it enforces password policies and integrates with directory services for its management plane, the explicit identity verification step *before* modifying an authentication factor, beyond the initial authentication to access the management plane, relies on the broader VCF SSO or federated identity provider for centralized organizational user management."
8.3.4,IAC-22,"8.3.4 Invalid authentication attempts are limited by: 
 • Locking out the user ID after not more than 10 attempts.
 • Setting the lockout duration to a minimum of 30 minutes or until the user’s identity is confirmed. 
 Applicability Notes
 This requirement is not intended to apply to user accounts on point-of-sale terminals that have access to only one card number at a time to facilitate a single transaction.",Contributes,"VMware Cloud Foundation enforces robust account lockout policies across its management components to limit invalid authentication attempts. VCF Operations locks accounts after a configurable number of failed login attempts, with a default threshold of seven attempts. For VCF Operations for Networks, accounts are locked after five consecutive failed attempts, with an initial lockout duration of 15 minutes that increases with subsequent failures up to a maximum of one day. The super administrator account lockout policy is activated by default and cannot be deactivated. VCF Automation supports account lockout after a configurable number of invalid login attempts when enabled through password policy system settings, allowing administrators to manually unlock accounts if necessary. NSX Manager provides configurable lockout periods and maximum authentication failure thresholds via CLI commands, with default lockout and reset periods set to 900 seconds.

While the platform provides the necessary technical controls for limiting invalid authentication attempts, administrators are responsible for configuring these settings across all VCF components to align with organizational security policies. This includes ensuring that the maximum number of invalid attempts does not exceed 10 and that the lockout duration is set to a minimum of 30 minutes or until the user's identity is confirmed, as some default settings may be lower than the specified minimum duration."
8.3.5,"IAC-07, IAC-10, IAC-10.1","8.3.5 If passwords/passphrases are used as authentication factors to meet Requirement 8.3.1, they are set and reset for each user as follows: 
 • Set to a unique value for first-time use and upon reset.
 • Forced to be changed immediately after the first use.",Contributes,"VMware Cloud Foundation (VCF) provides robust technical capabilities for managing authenticators and enforcing password policies across its components. VCF SSO serves as the centralized authentication service, supporting integration with enterprise identity providers like Active Directory or LDAP for user provisioning and authentication.

For local accounts, VCF components such as NSX Manager, VCF Operations, and VCF Automation enforce stringent password complexity, length, and lifespan requirements. NSX Manager mandates a minimum of 12 characters with diverse character types and a configurable expiration, while VCF Operations requires a minimum of 15 characters with similar complexity rules. SDDC Manager offers centralized password lifecycle management, enabling administrators to rotate passwords on demand or on a scheduled basis, generating randomized passwords that conform to component policies. For service-to-service authentication, VCF utilizes certificate-based credentials and API access tokens that rotate after each use.

While VCF provides the technical enforcement layer for password policies and lifecycle management, the specific requirements for setting unique initial passwords for first-time user accounts and forcing an immediate password change after the first login are typically managed by the integrated enterprise identity provider or require specific organizational processes and configurations beyond the direct scope of VCF's built-in capabilities.

PAIF: Not Assessed | VLR: Not Applicable | vDefend: Contributes | VMware vDefend enforces strong password complexity, length, and lifespan requirements across its management interfaces, contributing to the organization's overall password-based authentication posture.

The Security Services Platform (SSP), vDefend's centralized management console, enforces password policies for local user accounts, requiring a minimum of 12 characters with diverse character types and enforcing validity periods of 180 days for admin/audit users and 60 days for installer users. NSX Manager, which manages vDefend firewall policies, enforces similar password complexity through Linux PAM modules, including a minimum of 12 characters and a default 90-day expiration. SSP also supports integration with directory services such as Active Directory over LDAPS, allowing organizations to apply their enterprise-wide password policies to vDefend administrative access through federated authentication.

vDefend contributes to secure password management by enforcing complexity and lifespan, but the explicit mechanisms for setting unique initial passwords for first-time local user accounts and mandating an immediate password change after the first use are not detailed as being directly enforced by vDefend itself. These aspects often rely on the integrated directory service or organizational procedures."
