Control ID,SCF ID,Description,Control Coverage,Response
9.4(e),"GOV-02, CHG-01, CHG-02, OPS-01.1","Implement documented policies, procedures and controls for ICT change management that are based on a risk assessment approach.",Contributes,"VMware Cloud Foundation provides robust technical controls for managing configuration changes across the infrastructure stack. VCF Operations offers Configuration Drifts, which monitors changes against assigned desired values, and integrates configuration templates with source control repositories for versioning, auditing, and review-based change control. It tracks each configuration change to the authenticated user who initiated it.

vSphere Lifecycle Manager (vLCM) enforces desired-state configuration for ESX hosts, including drivers, firmware, and add-on software, detecting and remediating deviations from approved baselines.

VCF Automation includes workflow capabilities with approval policies for deployed catalog instances and integrates with IT Service Management platforms for change tracking and approval. Role-based access control restricts who can initiate configuration changes, and audit logging captures all change activity for review.

VMware Live Recovery implements granular role-based access controls that separate change authority across disaster recovery functions, such as creating or modifying recovery plans and protection groups. It generates comprehensive audit log events that track changes to permissions and configurations, including replication settings.

VLR enforces consistency by synchronizing internal plan data after recovery plan edits and provides structured tools like the DR IP Customizer for controlled network configuration changes. Orchestrator workflows offer parameterized, repeatable processes for managing replication and protection group configurations, and a scripting API supports integration with existing change management processes.

VMware vDefend contributes configuration change control within its network security policy domain. The Security Services Platform deployment wizard performs thorough validations before implementing configuration changes, ensuring correctness and compatibility.

Security Intelligence supports staged policy enforcement, allowing policies to be deployed in monitoring mode to observe effects before full enforcement. It monitors changes to input entities for policy recommendations and reports new configurations hourly.

A hierarchical configuration model through Global and Local Managers enables centralized change propagation while supporting site-specific change control.

While these platforms provide the essential technical controls and mechanisms to govern changes, the organization is responsible for implementing documented policies and procedures that define the overall ICT change management framework. This includes establishing the formal processes for initiating, reviewing, approving, testing, and deploying changes, as well as defining the roles and responsibilities for each step.

The customer must also establish and execute a risk assessment approach for all proposed changes, leveraging the platform's capabilities for pre-validation, impact analysis, and audit trails to inform these assessments and ensure changes are evaluated for potential risks before implementation."
9.4(f),"GOV-02, VPM-01, VPM-05",Have appropriate and comprehensive documented policies for patches and updates.,Contributes,"VMware Cloud Foundation provides comprehensive, integrated lifecycle management capabilities that are fundamental to an effective patch and update program.

SDDC Manager orchestrates updates across the entire VCF infrastructure stack, including ESXi hosts, vCenter Server, NSX, and vSAN. The VCF Operations patch planner identifies, downloads, and orchestrates the installation of updates and patches, performing pre-update validation and managing component interdependencies.

vSphere Lifecycle Manager (vLCM) manages desired-state configurations for ESXi hosts, including software patches, firmware, and drivers through Hardware Support Manager (HSM) plugins, ensuring hosts remain compliant with defined baselines. PowerCLI cmdlets further enable programmatic management of patches, baselines, and remediation actions.

VCF Operations compliance management continuously monitors the infrastructure for configuration drift and provides automated remediation capabilities, while diagnostics detect known issues and vulnerabilities within the VCF software stack.

VMware vDefend complements these capabilities by providing network-level compensating controls that reduce exploitation risk during the window between vulnerability disclosure and patch deployment.

The Distributed IDS/IPS detects and blocks exploitation attempts against known vulnerabilities, allowing for virtual patching through custom signatures.

Microsegmentation capabilities of the Distributed Firewall isolate unpatched or vulnerable workloads, limiting lateral movement and reducing the blast radius of potential exploits.

Advanced Threat Prevention (ATP) and Malware Prevention provide behavioral analysis and sandboxing to detect zero-day exploits and malware targeting unpatched systems.

Security Intelligence offers traffic flow analysis and anomaly detection, providing visibility into potential exploitation activity and aiding in the prioritization of patching efforts.

While VMware Cloud Foundation and vDefend provide the robust technical mechanisms and tools for executing a comprehensive patch and update program, the organization remains responsible for defining, documenting, and maintaining the overarching policies that govern these activities. This includes establishing the scope, frequency, approval processes, roles, responsibilities, and communication plans for all patches and updates across the environment. The platforms facilitate the enforcement and verification of these policies but do not generate or store the organizational policy documentation itself."
11.2(b),BCD-01,"Quickly, appropriately and effectively respond to, and resolve, all ICT-related incidents in a way that limits damage and prioritises the resumption of activities and recovery actions.",Contributes,"VMware Cloud Foundation provides robust resilience and recovery capabilities, including vSphere High Availability for automated workload restarts on surviving hosts and vSAN stretched clusters for continuous operation across availability zones. It ensures the recoverability of its management components through scheduled backups and facilitates workload mobility and replication between sites using VMware HCX. VCF Operations monitors infrastructure health and generates alerts, which are crucial for timely incident detection. VMware Live Recovery is specifically designed to orchestrate recovery actions, offering executable recovery plans that define the sequence and priority for failover operations. It supports non-disruptive testing to validate contingency procedures, provides host-based replication with configurable Recovery Point Objectives, and automates network reconfiguration during recovery. VMware vDefend maintains the security posture, including distributed and gateway firewall policies, during disaster recovery events and workload migrations, preventing security gaps as workloads fail over and contributing to damage limitation.

While these platforms deliver extensive technical tools for incident response, recovery, and damage limitation, the overall incident management process, the definition of specific response procedures, the prioritization of recovery actions, and the establishment of a comprehensive Business Continuity Management System (BCMS) are the responsibility of the customer. This includes developing and implementing organizational policies, conducting impact analyses, defining recovery playbooks, and assigning human accountability for incident response and resolution."
11.2(c),BCD-01,"Activate, without delay, dedicated plans that enable containment measures, processes and technologies suited to each type of ICT-related incident and prevent further damage.",Contributes,"VMware Cloud Foundation provides robust capabilities for immediate incident containment and resilience. vSphere High Availability automatically restarts virtual machines upon host failure, ensuring workload continuity. vSAN stretched clusters maintain application availability across availability zones, while vSAN Data Protection offers snapshot-based protection and replication to prevent data loss. Critical management components, including SDDC Manager, vCenter, and NSX, are configured with regular backup schedules to ensure rapid recovery of the control plane. VMware HCX facilitates workload mobility for planned migrations and disaster recovery, enabling the relocation of workloads away from affected areas. VCF Operations monitors infrastructure health, providing early warnings and capacity planning tools to proactively address potential issues.

VMware Live Recovery is purpose-built to define and execute dedicated contingency plans. Recovery plans serve as executable playbooks, outlining the sequence, priority, and configuration for failover operations, and are organized by protection groups aligned with application tiers. These plans support non-disruptive testing to validate procedures and offer distinct recovery modes for planned migrations and unplanned disaster recovery events. vSphere Replication provides host-based replication with configurable Recovery Point Objectives, while array-based replication integrates with third-party storage solutions. The DR IP Customizer automates network reconfiguration during recovery, ensuring seamless network connectivity.

VMware vDefend contributes by maintaining security posture through a Global Manager deployment, preserving distributed firewall and gateway firewall policies during disaster recovery events and workload migrations. This ensures security controls remain active as workloads fail over, preventing the introduction of security gaps during contingency plan activation.

While the platform provides comprehensive technical capabilities for automated and planned containment and recovery, the organization remains responsible for defining the specific content of recovery plans, identifying and categorizing each type of ICT-related incident, and establishing the overarching business continuity management system (BCMS). This includes developing organizational governance, conducting business impact analyses, and defining human processes and policies that dictate when and how these technical capabilities are activated."
11.2(e),BCD-01,Set out communication and crisis management actions (in accordance with Article 14) and report to the competent authorities (in accordance with Article 19).,Contributes,"VMware Cloud Foundation (VCF) establishes a resilient infrastructure foundation, incorporating vSphere High Availability for automatic workload restarts, vSAN stretched clusters for zone-level resilience, and comprehensive backup and recovery mechanisms for management components. VCF Operations provides continuous health monitoring and alerts, enabling early detection of conditions that could escalate into crises. VMware Live Recovery (VLR) is purpose-built to define and execute contingency plans, offering executable recovery playbooks that sequence failover operations for virtual machines organized into protection groups. VLR supports non-disruptive testing to validate these procedures and provides host-based and array-based replication with configurable Recovery Point Objectives. VMware vDefend ensures the continuity of security posture during disaster recovery events and workload migrations by preserving distributed firewall and gateway firewall policies, thereby maintaining critical security controls as workloads transition between sites.

While these platforms provide the technical capabilities for infrastructure resilience and recovery, the organization remains responsible for defining the overarching communication and crisis management actions, including the identification of competent authorities and the establishment of reporting protocols. This encompasses developing comprehensive business continuity management system (BCMS) frameworks, organizational governance processes, and specific communication plans that detail how and when to report to relevant stakeholders and authorities during a crisis."
11.3,BCD-01,"Financial entities shall implement associated ICT response and recovery plans which, for entities other than microenterprises, shall be subject to independent internal audit reviews.",Contributes,"VMware Live Recovery is purpose-built to facilitate contingency planning, providing executable recovery plans that define the sequence, priority, and configuration for failover operations. These plans support non-disruptive testing to validate procedures without impacting production workloads, offering both planned migration and disaster recovery modes. VMware Cloud Foundation (VCF) underpins these capabilities with built-in business continuity and disaster recovery features, including vSphere High Availability for automatic VM restarts, vSAN stretched clusters for zone-level resilience, and comprehensive backup schedules for all management components. VMware HCX further enables workload mobility and replication between sites, while VCF Operations monitors infrastructure health and provides early warning of potential failures. VMware vDefend ensures security posture is maintained during disaster recovery events and workload migrations, preserving distributed firewall and gateway firewall policies to prevent security gaps during contingency plan activation.

While the platform provides the technical mechanisms and tools for ICT response and recovery, the financial entity is responsible for defining the specific content of these plans, including business process alignment, communication strategies, and detailed recovery objectives. Establishing the broader Business Continuity Management System (BCMS) framework, including impact analyses, organizational governance processes, and the assignment of human accountability for plan execution, remains an organizational responsibility. Furthermore, the requirement for independent internal audit reviews of these plans necessitates the establishment of an internal audit function and associated processes by the financial entity."
11.4,"BCD-01, BCD-04","Financial entities shall put in place, maintain and periodically test appropriate ICT business continuity plans, notably with regard to critical or important functions outsourced or contracted through arrangements with ICT third-party service providers.",Contributes,"VMware Cloud Foundation (VCF) provides a robust foundation for ICT business continuity through integrated capabilities such as vSphere High Availability (HA) for automatic VM restarts, vSAN stretched clusters for cross-zone resilience, and vSAN Data Protection for snapshot-based recovery.

VCF mandates regular backup schedules and retention policies for all management components, including SDDC Manager, vCenter, and NSX, utilizing Changed Block Tracking (CBT) for efficient incremental backups.

VMware HCX facilitates workload mobility and replication across sites, supporting various migration scenarios from bulk moves to zero-downtime live migrations.

VCF Operations monitors infrastructure health, provides alerts, and offers capacity planning tools to proactively manage resource availability.

VMware Live Recovery is purpose-built for contingency planning, enabling the creation of executable recovery plans that define the sequence and priority of failover operations for protected workloads. It offers non-disruptive testing capabilities, allowing organizations to validate recovery procedures without impacting production, with support for both test recovery and planned migration modes.

vSphere Replication provides host-based replication with configurable Recovery Point Objectives (RPO) down to 60 seconds, and array-based replication integrates with third-party storage solutions.

VMware Live Recovery supports bidirectional protection, automated network reconfiguration via DR IP Customizer, and integrates with DRS/DPM for resource optimization during recovery.

VMware vDefend further contributes by ensuring that security posture, including distributed and gateway firewall policies, is maintained during disaster recovery events and workload migrations, preserving security controls as workloads fail over.

While the VMware platforms provide comprehensive technical capabilities for implementing, maintaining, and testing ICT business continuity, the financial entity is responsible for establishing the overarching Business Continuity Management System (BCMS). This includes defining the business continuity plans themselves, identifying critical and important functions, especially those outsourced or contracted through third-party ICT service providers, and establishing the governance processes for these arrangements. The organization must also define the periodicity of testing, design specific test scenarios, establish evaluation criteria, conduct after-action reviews, and ensure human accountability for the execution and maintenance of these plans."
11.5,"BCD-01, RSK-08","Financial entities shall conduct a business impact analysis (BIA) of their exposures to severe business disruptions, assessing the potential impact using quantitative and qualitative criteria. The BIA must consider the criticality of identified functions, processes, and dependencies, and ensure ICT assets and services are designed for redundancy.",Contributes,"VMware Cloud Foundation (VCF) provides inherent business continuity and disaster recovery capabilities through integrated components. vSphere High Availability (HA) automatically restarts virtual machines on surviving hosts upon failure detection, ensuring workload resilience. vSAN stretched clusters extend a single logical vSAN cluster across two availability zones, maintaining operation during zone failures or maintenance. VCF management components, including SDDC Manager and vCenter, are configured with regular backup schedules and retention policies. VMware HCX facilitates workload mobility and replication between sites, supporting various migration scenarios. VCF Operations monitors infrastructure health, surfaces alerts, offers capacity planning tools to proactively manage resource availability.

VMware Live Recovery is purpose-built for contingency planning, enabling the definition of executable recovery plans that specify the sequence, priority, and configuration for failover operations. It organizes virtual machines into protection groups aligned with application tiers or business functions and supports non-disruptive testing of these plans. vSphere Replication provides host-based replication with configurable Recovery Point Objectives (RPO) down to 60 seconds, and array-based replication integrates with third-party storage solutions. VMware Live Recovery supports bidirectional protection and automates network reconfiguration during recovery.

VMware vDefend contributes to business continuity by enabling a Global Manager deployment that preserves distributed firewall and gateway firewall policies during disaster recovery events and workload migrations, ensuring security controls remain active as workloads fail over.

While these platforms provide the technical foundation for resilience and recovery, the financial entity is responsible for conducting the actual business impact analysis (BIA). This includes assessing potential impacts using quantitative and qualitative criteria, identifying the criticality of functions, processes, and dependencies, and defining the specific recovery objectives (RTO/RPO) that the platform's capabilities will then implement. The establishment of the broader Business Continuity Management System (BCMS) framework, including organizational governance and comprehensive BC/DR playbooks, remains an organizational responsibility."
11.6,RSK-01,"Financial entities shall, as part of their comprehensive ICT risk management:",Not Applicable,"End user activity or process, design decision, or activity out of scope."
11.6(a),"BCD-01, BCD-04",Test the ICT business continuity plans and the ICT response and recovery plans in relation to ICT systems supporting all functions at least yearly.,Contributes,"VMware Cloud Foundation provides the foundational infrastructure and integrated capabilities essential for building and exercising robust business continuity and disaster recovery plans.

vSphere High Availability automatically restarts virtual machines upon host failure, while vSAN stretched clusters maintain data availability across availability zones, both of which can be tested by simulating failures. VMware HCX facilitates workload mobility, enabling test migrations between sites to validate recovery procedures. Management component backup and restore processes for SDDC Manager, vCenter, and NSX can be regularly tested to ensure operational resilience.

VMware Live Recovery is purpose-built for contingency planning, offering non-disruptive testing of recovery plans. These plans define the sequence and configuration for failover operations and can be exercised without impacting production workloads. VMware Live Recovery supports both test recovery, simulating unplanned failures, and planned migration modes, validating orderly site evacuations. These tests exercise the full recovery sequence, including VM power-on ordering and network reconfiguration, and can be repeated frequently due to their non-disruptive nature.

VMware vDefend ensures that security posture, including distributed and gateway firewall policies, is maintained during disaster recovery events and workload migrations, preserving security controls as workloads fail over or are tested.

While the platform provides the comprehensive technical mechanisms to execute and validate business continuity and disaster recovery procedures, the organization is responsible for defining the overarching business continuity and disaster recovery plans, establishing the scope of ICT systems supporting all functions, scheduling and conducting these tests at least yearly, designing specific test scenarios, evaluating test outcomes, and performing after-action reviews.

The platform provides the tools; the customer provides the governance and execution of the testing program."
11.6(b),"BCD-01, BCD-04",Test the crisis communication plans established in accordance with Article 14.,Contributes,"VMware Cloud Foundation (VCF) and VMware Live Recovery (VLR) provide the robust technical capabilities to test the underlying infrastructure and application recovery mechanisms that are critical during a crisis.

VCF enables the testing of vSAN stretched clusters by simulating site failures, validates vSphere High Availability by failing hosts, and exercises workload migrations using HCX. It also supports testing management component backup and restore procedures.

VMware Live Recovery offers non-disruptive testing of disaster recovery plans as a core operational capability, including test recovery and planned migration modes. These modes exercise the full recovery sequence, such as virtual machine power-on ordering, network reconfiguration, and IP address customization, without impacting production operations. The VMware Live Recovery API and PowerCLI enable automated testing of these recovery plans.

While the platforms enable the technical testing of recovery, the control specifically targets crisis communication plans. The definition, implementation, and testing of these organizational crisis communication plans, including stakeholder notification, communication channels, escalation procedures, and public relations, remain the customer's responsibility.

The platforms do not provide mechanisms to simulate or validate the human and procedural aspects of crisis communication, such as exercise scheduling, scenario design, evaluation criteria, and after-action reviews for communication effectiveness."
