Control ID,SCF ID,Description,Control Coverage,Response
11.8,BCD-01,Financial entities shall keep readily accessible records of activities before and during disruption events when their plans are activated.,Contributes,"VMware Cloud Foundation (VCF) provides the foundational capabilities that generate critical event data during business continuity and disaster recovery (BC/DR) operations.

vSphere High Availability (HA) automatically logs host and virtual machine failover events. vSAN stretched clusters log operational continuity events across availability zones.

VCF management components, including SDDC Manager, vCenter, and NSX, are configured for regular backups, which inherently capture system state and configuration changes that precede and occur during disruption events.

VMware HCX logs workload mobility actions, such as migrations and replications. VCF Operations monitors infrastructure health, surfacing alerts and providing capacity planning insights, all of which generate auditable event data.

VMware Live Recovery (VLR) is purpose-built for contingency planning, with recovery plans defining executable BC/DR playbooks. VLR's plan status monitoring tracks the progression of recovery operations, including non-disruptive testing, planned migrations, and disaster recovery events, generating detailed logs of each step. vSphere Replication and array-based replication also log their respective data protection activities.

VMware vDefend ensures security posture is maintained during DR events and workload migrations, with its Global Manager deployment logging policy enforcement and changes.

While the VMware platforms generate extensive event data and logs related to BC/DR activities, the responsibility for defining, collecting, aggregating, and ensuring the *readily accessible* nature of these records for compliance purposes rests with the customer.

Organizations must implement a comprehensive logging strategy, often involving a centralized Security Information and Event Management (SIEM) solution, to collect logs from all relevant VCF, VLR, and vDefend components. This includes establishing specific retention policies for these BC/DR-related records and defining the processes for their review and accessibility during and after disruption events, aligning with their overall business continuity management program."
11.9,BCD-01,"Central securities depositories shall provide the competent authorities with copies of the results of the ICT business continuity tests, or of similar exercises.",Contributes,"VMware Cloud Foundation (VCF) establishes a resilient infrastructure through vSphere High Availability for automatic VM restarts, vSAN stretched clusters for zone-level resilience, and comprehensive backup schedules for management components. VMware HCX further enables workload mobility and replication for disaster recovery scenarios. VMware Live Recovery is purpose-built for contingency planning, allowing organizations to define and execute recovery plans that sequence failover operations. It supports non-disruptive testing of these recovery plans, enabling validation of procedures without impacting production workloads. Live Recovery tracks recovery plan state and provides status monitoring, offering visibility into the outcomes of these tests. VMware vDefend contributes to the overall resilience by maintaining security posture, including distributed firewall and gateway firewall policies, during disaster recovery events and workload migrations.

While the platform provides the technical capabilities to perform ICT business continuity tests and observe their internal results, the generation of formal, auditable copies of these test results for submission to competent authorities remains a customer responsibility. Organizations must establish the processes for documenting test outcomes, compiling them into the required report format, and then formally providing these copies to the relevant regulatory bodies."
11.1,BCD-01,"Financial entities, other than microenterprises, shall report to the competent authorities, upon their request, an estimation of aggregated annual costs and losses caused by major ICT-related incidents.",Contributes,"VMware Cloud Foundation (VCF) provides a resilient and recoverable infrastructure that significantly mitigates the impact of major ICT-related incidents. This includes vSphere High Availability (HA) for automatic workload restart, vSAN stretched clusters for cross-zone resilience, and vSAN Data Protection for snapshot-based recovery. VCF mandates regular backup schedules and retention policies for all management components, including SDDC Manager, vCenter, and NSX, utilizing Changed Block Tracking (CBT) for efficient incremental backups.

VMware HCX facilitates workload mobility and replication for disaster recovery and migration scenarios. VCF Operations continuously monitors infrastructure health, providing alerts and capacity planning tools to proactively address potential issues that could lead to incidents.

VMware Live Recovery further enhances contingency planning with executable recovery plans, protection groups, and non-disruptive testing capabilities. It supports both planned migrations and disaster recovery scenarios, leveraging vSphere Replication for host-based RPO down to 60 seconds and integrating with array-based replication. VMware Live Recovery also supports bidirectional protection and automates network reconfiguration during recovery with the DR IP Customizer.

VMware vDefend ensures that security posture, including distributed and gateway firewall policies, is maintained during disaster recovery events and workload migrations, preventing the introduction of security gaps during contingency plan activation.

While the platform provides robust technical capabilities for preventing, mitigating, and recovering from major ICT-related incidents, it does not inherently track, calculate, or report the aggregated annual costs and losses associated with such events. Financial entities must establish and implement their own organizational processes, financial accounting mechanisms, and reporting procedures to estimate and report these costs and losses to competent authorities upon request. This includes defining methodologies for cost attribution, loss quantification, and the formal reporting framework, which are outside the technical scope of the platform."
11.11,BCD-01,"The ESAs, through the Joint Committee, shall by 17 July 2024 develop common guidelines on the estimation of aggregated annual costs and losses referred to in paragraph 10.",Contributes,"VMware Cloud Foundation, VMware Live Recovery, and VMware vDefend collectively provide a robust technical foundation for business continuity and disaster recovery, directly influencing an organization's exposure to aggregated annual costs and losses.

VCF delivers built-in resilience through vSphere High Availability, vSAN stretched clusters for zone-level fault tolerance, and comprehensive backup capabilities for management components. VMware HCX enables workload mobility and replication, while VCF Operations provides critical monitoring and capacity planning to proactively mitigate risks.

VMware Live Recovery is purpose-built for contingency planning, offering executable recovery plans, granular protection groups, and non-disruptive testing to validate recovery procedures. It integrates host-based and array-based replication with configurable RPOs, ensuring data consistency and rapid recovery.

VMware vDefend maintains security posture during disaster recovery events and workload migrations, preserving distributed and gateway firewall policies to prevent security gaps during failover.

These capabilities significantly reduce the likelihood and impact of disruptive events, thereby minimizing potential financial and operational losses.

While these platforms provide the essential technical capabilities and operational data that inform an organization's risk profile and resilience posture, the development of common guidelines for estimating aggregated annual costs and losses remains an organizational governance and policy responsibility.

This requires defining specific methodologies, establishing financial models, and integrating the technical performance and recovery metrics from the platforms into a broader enterprise risk management and financial planning framework. The platforms do not automate the creation of these estimation guidelines or the financial modeling process itself."
12.5,BCD-09,"Central securities depositories shall maintain at least one secondary processing site endowed with adequate resources, capabilities, functions and staffing arrangements to ensure business needs.",Contributes,"VMware Cloud Foundation provides the foundational infrastructure for establishing alternate processing sites, ensuring consistent security and operational capabilities across locations.

vSAN stretched clusters extend a single logical cluster across two availability zones, mirroring data between sites to tolerate complete site failures while keeping data accessible, provided adequate capacity is reserved for failover. NSX Federation delivers centralized policy configuration and enforcement across multiple locations, maintaining consistent network policy between primary and alternate sites, with NSX disaster recovery deployments enabling secondary site takeover of networking functions. VCF Operations supports single-source configuration for identity and access management across VCF components and multiple geolocations, ensuring equivalent security configurations, baselines, and access controls apply across all managed sites. Further resilience is provided by vSphere HA with admission control, Proactive HA, VMware vMotion, HCX for workload mobility, and network redundancy.

VMware Live Recovery provides the orchestration platform for establishing and operating an alternate processing site for disaster recovery, supporting both planned migration and unplanned recovery to an alternative infrastructure with equivalent hardware, network, and storage resources.

vSphere Replication maintains current copies of protected workloads at the alternate site through continuous host-based replication, ensuring data currency. Bidirectional protection allows each site to serve as both a protected and recovery location, operating as fully capable processing environments. vDefend Security Services Platform can be deployed on vSAN stretched clusters spanning two sites, providing a foundation for an alternate processing site that maintains security services availability, with distributed firewall, IDS/IPS, and other vDefend security capabilities operating with equivalent policy enforcement when scaled appropriately.

While the platform provides comprehensive technical capabilities for infrastructure, workload mobility, and security at an alternate site, establishing the physical alternate processing facility and its associated agreements remains an organizational responsibility. Organizations must also ensure adequate staffing arrangements are in place at the secondary processing site to meet business needs and reserve sufficient capacity for failover operations."
12.5(a),"BCD-09, BCD-09.1",The secondary processing site shall be located at a geographical distance from the primary site to ensure a distinct risk profile and prevent it from being affected by the same event.,Contributes,"VMware Cloud Foundation provides the foundational infrastructure for establishing alternate processing sites with inherent geographical separation and distinct risk profiles. vSAN stretched clusters distribute compute and storage across two physically separated data sites, utilizing a witness host at a third independent location to ensure data availability and fault isolation across a three-location topology. This architecture prevents a single site failure from resulting in data loss and supports Layer 3 routed networking between data sites for enhanced fault isolation.

NSX disaster recovery deployments are designed for multi-site operations, where the physical separation of primary and secondary sites is fundamental to the model, allowing a secondary site to assume networking and workload operations during a catastrophic primary site failure. VMware Live Recovery builds upon this by providing the orchestration platform for disaster recovery, operating between inherently separated protected and recovery sites.

This two-site architecture ensures processing occurs in distinct environments, reducing susceptibility to threats affecting a single location. VLR supports logical isolation at the storage layer and network isolation for test recovery, further reinforcing the independence of the sites.

VMware vDefend, when deployed on such a stretched cluster configuration, extends security services like distributed firewall and IDS/IPS across these physically distinct sites, maintaining consistent policy enforcement.

While the platform provides the comprehensive technical mechanisms for operating across geographically distinct sites with inherent separation and resilience, the organizational responsibility remains for the physical establishment of the alternate processing facility and the strategic decision regarding its geographical location to ensure a distinct risk profile. The platform enables the technical operation and resilience across these sites, but does not perform the physical site selection or construction."
12.5(b),BCD-09,"The site shall be capable of ensuring the continuity of critical or important functions identically to the primary site, or providing the necessary service level within the recovery objectives.",Contributes,"VMware Cloud Foundation provides the foundational infrastructure for establishing alternate processing sites, ensuring consistent security and operational capabilities across locations. vSAN stretched clusters extend a single logical cluster across two availability zones, mirroring data between sites to tolerate complete site failures while maintaining data accessibility. NSX Federation centralizes network policy configuration and enforcement across multiple locations, ensuring consistent network security. VCF Operations supports single-source configuration for identity and access management, security baselines, and configuration profiles, which apply across all managed sites to maintain equivalent security postures.

VMware Live Recovery provides the orchestration platform for establishing and operating an alternate processing site for disaster recovery. It supports both planned migration and unplanned disaster recovery, leveraging vSphere Replication to maintain current copies of protected workloads at the alternate site with configurable RPO intervals. Bidirectional protection allows each site to serve as both a protected and recovery location, operating as fully capable processing environments, provided the recovery site has equivalent hardware, network, and storage resources.

VMware vDefend, deployed on a vSAN stretched cluster, ensures equivalent network security policy enforcement, including distributed firewall and IDS/IPS capabilities, at the alternate site.

While the platform provides the comprehensive infrastructure and orchestration capabilities for an alternate processing site to ensure continuity or meet recovery objectives, the establishment of the physical alternate processing facility and its associated agreements remains an organizational responsibility.

Organizations must also ensure sufficient capacity is reserved at the alternate site to accommodate all critical workloads during a failover and are responsible for defining specific recovery objectives, establishing disaster recovery policies and processes, and conducting regular testing and validation."
12.5(c),"BCD-09, BCD-09.2",The site shall be immediately accessible to the financial entity's staff.,Contributes,"VMware Cloud Foundation (VCF) provides the foundational infrastructure for establishing alternate processing sites, leveraging vSAN stretched clusters to ensure data remains accessible even during a complete site failure. NSX Federation maintains consistent network policy across primary and alternate sites, while VCF Operations centralizes identity and access management, applying security baselines and access controls across all managed locations. VMware Live Recovery (VLR) orchestrates the operation of these alternate sites, enabling planned migrations to validate recovery paths and ensuring that protected virtual machines can be started at the recovery site during unplanned disasters. VLR's support for bidirectional protection and various replication methods, including vSphere Replication, ensures data currency and operational flexibility. VMware vDefend, when deployed on a vSAN stretched cluster, extends network security policy enforcement to the alternate site, maintaining equivalent distributed firewall and IDS/IPS capabilities.

While the platform provides the robust technical infrastructure, orchestration, and security services necessary for an alternate site to be immediately accessible, the establishment of the physical alternate processing facility, the provisioning of equivalent hardware, network, and storage resources at the recovery site, and the definition of organizational policies for staff access and broader accessibility planning remain the responsibility of the customer."
13.1,"THR-01, THR-03","Financial entities shall have capabilities and staff to gather information on vulnerabilities and cyber threats, ICT-related incidents, and analyze their likely impact.",Contributes,"VMware vDefend provides robust capabilities for gathering and analyzing threat intelligence and ICT-related incidents. It continuously consumes updated threat feeds, including IDS signatures and URL/threat indicators, which are leveraged by IDS/IPS and Advanced Threat Prevention components to detect and respond to known and emerging network-layer threats. The Security Intelligence component visualizes IDS/IPS event data with granular details, while Network Detection and Response (NDR) employs machine learning and advanced analytics to automatically correlate related events into comprehensive threat campaigns for further review.

While vDefend operationally applies and analyzes threat intelligence, the broader management of the threat intelligence program, its dissemination across the organization, and the assignment of dedicated staff to oversee these functions require the implementation of complementary customer-defined processes and tooling."
13.2,"BCD-05, IRO-13","Financial entities shall put in place post ICT-related incident reviews after a major ICT-related incident disrupts their core activities, analyzing causes and identifying required improvements.",Not Applicable,"End user activity or process, design decision, or activity out of scope."
13.2(a),"BCD-05, IRO-13",Reviews shall determine the promptness in responding to security alerts and determining the impact/severity of incidents.,Not Applicable,"End user activity or process, design decision, or activity out of scope."
13.2(b),"BCD-05, IRO-13","Reviews shall determine the quality and speed of performing a forensic analysis, where deemed appropriate.",Not Applicable,"End user activity or process, design decision, or activity out of scope."
13.2(c),"BCD-05, IRO-13",Reviews shall determine the effectiveness of incident escalation within the financial entity.,Not Applicable,"End user activity or process, design decision, or activity out of scope."
13.2(d),"BCD-05, IRO-13",Reviews shall determine the effectiveness of internal and external communication.,Not Applicable,"End user activity or process, design decision, or activity out of scope."
13.3,"BCD-05, IRO-13","Lessons derived from digital operational resilience testing, real life incidents, challenges in plan activation, and information exchanged with counterparts/supervisory reviews shall be duly incorporated into the ICT risk assessment process and form the basis for appropriate reviews of the ICT risk management framework.",Not Applicable,"End user activity or process, design decision, or activity out of scope."
13.4,GOV-05,"Financial entities shall monitor the effectiveness of their digital operational resilience strategy, map the evolution of ICT risk over time, and analyze the frequency, types, magnitude and evolution of incidents to enhance cyber maturity and preparedness.",Not Applicable,"End user activity or process, design decision, or activity out of scope."
13.5,GOV-01.2,Senior ICT staff shall report at least yearly to the management body on the findings referred to in paragraph 3 and put forward recommendations.,Not Applicable,"End user activity or process, design decision, or activity out of scope."
13.6,"SAT-01, SAT-02, SAT-03, SAT-03.6",Financial entities shall develop ICT security awareness programmes and digital operational resilience training as compulsory modules applicable to all employees and senior management staff.,Not Applicable,"End user activity or process, design decision, or activity out of scope."
13.7,"TDA-01, TDA-01.1","Financial entities, other than microenterprises, shall monitor relevant technological developments on a continuous basis to understand their possible impact on ICT security and digital operational resilience, and keep up-to-date with the latest ICT risk management processes.",Not Applicable,"End user activity or process, design decision, or activity out of scope."
14.1,"IRO-01, IRO-02, IRO-07, IRO-10, IRO-11","As part of the ICT risk management framework, financial entities shall have in place crisis communication plans enabling a responsible disclosure of, at least, major ICT-related incidents or vulnerabilities to clients and counterparts as well as to the public, as appropriate.",Contributes,"VMware Cloud Foundation, VMware Live Recovery, and VMware vDefend provide critical technical capabilities that support the detection, analysis, containment, and recovery phases of ICT-related incidents and vulnerabilities.

VCF Operations correlates events, surfaces faults, and offers a Troubleshooting Incidents page for managing and tracking incidents with metadata such as status, impact, and urgency, integrating with existing ITSM workflows like ServiceNow. VCF also provides automated recovery mechanisms through vSphere HA, Proactive HA, and vSphere Fault Tolerance.

VMware vDefend enhances these capabilities with integrated threat detection, investigation, and automated containment through IDS/IPS, network detection, and quarantine policies, correlating events to identify multi-stage attack campaigns and prioritizing response efforts based on impact scores.

VMware Live Recovery contributes by providing structured data protection incident response through documented recovery plans, non-disruptive testing, and automated failover orchestration, ensuring repeatable recovery procedures and documenting outcomes for review.

These platforms collectively enable the identification, understanding, and technical resolution of incidents and vulnerabilities that would necessitate crisis communication.

While these platforms provide essential technical foundations for incident management, they do not govern the overarching ICT risk management framework, nor do they establish or maintain the organization's crisis communication plans.

The definition of what constitutes a ""major ICT-related incident or vulnerability"" requiring disclosure, the policy for responsible disclosure, the determination of appropriate audiences (clients, counterparts, public), and the execution of the communication process itself remain the responsibility of the financial entity.

The platforms do not manage the organizational processes, policies, or human accountability required for external crisis communication and disclosure."
14.2,"IRO-01, IRO-02, IRO-07, IRO-10, IRO-11","Financial entities shall implement communication policies for internal staff and for external stakeholders, differentiating between staff roles (e.g., those involved in response vs. those needing information).",Contributes,"VMware Cloud Foundation provides the technical infrastructure to support incident information flow through automated event detection, fault generation, and configurable notification rules. VCF Operations integrates with ServiceNow, allowing incidents to flow into existing ITSM workflows with structured attributes such as caller, category, and alert details, facilitating the technical delivery of incident-related information. VMware Live Recovery contributes by providing event logging and alarms for data protection incidents, and its structured recovery plans define repeatable response procedures that inherently require communication. VMware vDefend enhances these capabilities by providing integrated threat detection, investigation, and remediation, generating critical security events that necessitate timely communication.

While these platforms offer robust technical mechanisms for detecting events, generating alerts, and integrating with broader ITSM systems to facilitate information sharing, they do not establish or govern the organization-wide communication policies themselves. The responsibility for defining internal staff roles, differentiating information needs for various stakeholders (e.g., those involved in response versus those needing information), and implementing formal communication policies for both internal and external parties rests with the customer. The platforms do not maintain incident response documentation or manage the overarching processes for communication governance."
