Control ID,SCF ID,Description,Control Coverage,Response
4.1,CPL-01,"Financial entities shall implement the rules in Chapter II in accordance with the proportionality principle, considering their size and overall risk profile, and the nature, scale and complexity of their services, activities and operations.",Not Applicable,"End user activity or process, design decision, or activity out of scope."
4.2,CPL-01,"The application of Chapters III, IV and V (Section I) by financial entities shall be proportionate to their size, overall risk profile, and the nature, scale and complexity of their services, activities and operations, as specifically provided for in those Chapters.",Not Applicable,"End user activity or process, design decision, or activity out of scope."
4.3,CPL-01,Competent authorities shall consider the proportionality principle when reviewing the consistency of the ICT risk management framework based on reports submitted under Article 6(5) and Article 16(2).,Not Applicable,"End user activity or process, design decision, or activity out of scope."
5.1,GOV-01,Financial entities shall have an internal governance and control framework that ensures effective and prudent management of ICT risk to achieve a high level of digital operational resilience.,Not Applicable,"End user activity or process, design decision, or activity out of scope."
5.2,"GOV-01.1, GOV-04","The management body shall define, approve, oversee, and be responsible for the implementation of all arrangements related to the ICT risk management framework.",Not Applicable,"End user activity or process, design decision, or activity out of scope."
5.2(b),"GOV-01.1, GOV-04","The management body shall put in place policies that aim to ensure the maintenance of high standards of availability, authenticity, integrity and confidentiality, of data.",Not Applicable,"End user activity or process, design decision, or activity out of scope."
5.2(c),"GOV-01.1, GOV-04, HRS-03",The management body shall set clear roles and responsibilities for all ICT-related functions and establish appropriate governance arrangements.,Not Applicable,"End user activity or process, design decision, or activity out of scope."
5.2(d),"GOV-01.1, GOV-04","The management body bears the overall responsibility for setting and approving the digital operational resilience strategy (Article 6(8)), including determining the appropriate risk tolerance level for ICT risk and analyzing the impact tolerance for ICT disruptions.",Not Applicable,"End user activity or process, design decision, or activity out of scope."
5.2(e),"GOV-01.1, GOV-04","The management body shall approve, oversee and periodically review the implementation of the financial entity's ICT business continuity policy (Article 11(1)) and ICT response and recovery plans (Article 11(3)).",Not Applicable,"End user activity or process, design decision, or activity out of scope."
5.2(f),"GOV-01.1, GOV-04","The management body shall approve and periodically review the financial entity's ICT internal audit plans, ICT audits and material modifications to them.",Not Applicable,"End user activity or process, design decision, or activity out of scope."
5.2(g),"GOV-01.1, GOV-04","The management body shall allocate and periodically review the appropriate budget to fulfil digital operational resilience needs, including security awareness programmes, training, and ICT skills for staff.",Not Applicable,"End user activity or process, design decision, or activity out of scope."
5.2(h),"GOV-01.1, GOV-04",The management body shall approve and periodically review the financial entity's policy on arrangements regarding the use of ICT services provided by ICT third-party service providers.,Not Applicable,"End user activity or process, design decision, or activity out of scope."
5.2(i),GOV-01.2,"The management body shall put in place, at corporate level, reporting channels to be duly informed of ICT third-party arrangements, material changes, and major ICT-related incidents.",Not Applicable,"End user activity or process, design decision, or activity out of scope."
5.2(i)(i),"GOV-01.1, GOV-04",The reporting channels shall cover arrangements concluded with ICT third-party service providers on the use of ICT services.,Not Applicable,"End user activity or process, design decision, or activity out of scope."
5.2(i)(ii),"GOV-01.1, GOV-04",The reporting channels shall cover any relevant planned material changes regarding the ICT third-party service providers.,Not Applicable,"End user activity or process, design decision, or activity out of scope."
5.2(i)(iii),"GOV-01.1, GOV-04","The reporting channels shall cover the potential impact of such changes on critical or important functions, including a risk analysis summary, and at least major ICT-related incidents and their impact, response, recovery and corrective measures.",Not Applicable,"End user activity or process, design decision, or activity out of scope."
5.4,CPL-01,"Members of the management body shall actively keep up to date with sufficient knowledge and skills to understand and assess ICT risk and its impact, including by following specific regular training.",Not Applicable,"End user activity or process, design decision, or activity out of scope."
6.1,RSK-01,"Financial entities shall have a sound, comprehensive and well-documented ICT risk management framework as part of their overall risk management system to address ICT risk quickly, efficiently, and comprehensively.",Not Applicable,"End user activity or process, design decision, or activity out of scope."
6.2,"GOV-02, RSK-01, OPS-01.1","The framework shall include at least strategies, policies, procedures, ICT protocols and tools necessary to duly and adequately protect all information assets and ICT assets and relevant physical components/infrastructures from risks, damage, and unauthorized access/usage.",Not Applicable,"End user activity or process, design decision, or activity out of scope."
6.3,RSK-01,"Financial entities shall minimize the impact of ICT risk by deploying appropriate strategies, policies, and tools and shall provide complete and updated information on ICT risk and their framework to competent authorities upon request.",Not Applicable,"End user activity or process, design decision, or activity out of scope."
6.4,RSK-01,"Financial entities, other than microenterprises, shall assign the responsibility for managing and overseeing ICT risk to a control function and ensure appropriate independence to avoid conflicts of interest; they must ensure appropriate segregation and independence of functions according to the three lines of defence model or an internal risk management and control model.",Not Applicable,"End user activity or process, design decision, or activity out of scope."
6.5,RSK-01,"The ICT risk management framework shall be documented and reviewed at least once a year (periodically for microenterprises), upon major ICT-related incidents, and following supervisory instructions or audit/testing conclusions, and continuously improved. A report on the review shall be submitted to the competent authority upon request.",Not Applicable,"End user activity or process, design decision, or activity out of scope."
6.6,RSK-01,"The ICT risk management framework of financial entities, other than microenterprises, shall be subject to internal audit by auditors possessing sufficient knowledge, skills, expertise, and independence, commensurate to the ICT risk.",Not Applicable,"End user activity or process, design decision, or activity out of scope."
6.7,RSK-01,"Based on internal audit conclusions, financial entities shall establish a formal follow-up process for timely verification and remediation of critical ICT audit findings.",Not Applicable,"End user activity or process, design decision, or activity out of scope."
6.8,"PRM-01.1, RSK-01",The ICT risk management framework shall include a digital operational resilience strategy setting out how the framework shall be implemented.,Not Applicable,"End user activity or process, design decision, or activity out of scope."
6.8(a),"PRM-01.1, RSK-01",The strategy shall explain how the ICT risk management framework supports the financial entity's business strategy and objectives.,Not Applicable,"End user activity or process, design decision, or activity out of scope."
6.8(b),"PRM-01.1, RSK-01","The strategy shall establish the risk tolerance level for ICT risk, in accordance with the risk appetite, and analyze the impact tolerance for ICT disruptions.",Not Applicable,"End user activity or process, design decision, or activity out of scope."
6.8(c),"PRM-01.1, RSK-01","The strategy shall set out clear information security objectives, including key performance indicators and key risk metrics.",Not Applicable,"End user activity or process, design decision, or activity out of scope."
6.8(d),"PRM-01.1, RSK-01",The strategy shall explain the ICT reference architecture and any changes needed to reach specific business objectives.,Not Applicable,"End user activity or process, design decision, or activity out of scope."
6.8(e),"PRM-01.1, RSK-01","The strategy shall outline the different mechanisms put in place to detect ICT-related incidents, prevent their impact and provide protection from it.",Not Applicable,"End user activity or process, design decision, or activity out of scope."
6.8(f),"PRM-01.1, RSK-01",The strategy shall evidence the current digital operational resilience situation based on the number of major ICT-related incidents reported and the effectiveness of preventive measures.,Not Applicable,"End user activity or process, design decision, or activity out of scope."
6.8(g),"PRM-01.1, RSK-01",The strategy shall address implementing digital operational resilience testing.,Not Applicable,"End user activity or process, design decision, or activity out of scope."
6.8(h),"PRM-01.1, RSK-01",The strategy shall outline a communication strategy in the event of ICT-related incidents requiring disclosure (Article 14).,Not Applicable,"End user activity or process, design decision, or activity out of scope."
6.9,RSK-01,Financial entities may define a holistic ICT multi-vendor strategy (group or entity level) showing key third-party dependencies and explaining the rationale behind the procurement mix.,Not Applicable,"End user activity or process, design decision, or activity out of scope."
7,GOV-15,"Financial entities shall use and maintain updated ICT systems, protocols and tools that are:",Not Applicable,"End user activity or process, design decision, or activity out of scope."
7(a),"GOV-15, GOV-15.1, GOV-15.2, GOV-15.3, GOV-15.4, GOV-15.5, PRM-01, PRM-02, PRM-03, PRM-04, PRM-05, PRM-07","Appropriate to the magnitude of operations, in accordance with the proportionality principle (Article 4).",Contributes,"VMware Cloud Foundation provides the infrastructure for continuous monitoring of technology assets, identifying compliance drift, and surfacing non-compliant objects and associated violations through dashboards and alerts. Administrators define monitoring policies and customize settings per object through overrides, allowing monitoring to be tailored to the risk profile of individual assets.

VCF Operations for Logs aggregates data for visibility, and VCF Automation's Organizations model enables resource usage monitoring and enforcement of governance boundaries. User access patterns are continuously monitored, and role-based access in vCenter, including a dedicated Operator role, facilitates delegation of monitoring responsibilities.

VMware vDefend's Security Intelligence offers continuous network-level monitoring with flow visualization, anomaly detection, and NDR capabilities, supporting ongoing assessment of control effectiveness across in-scope workloads. Its IDS/IPS and ATP continuously monitor network traffic for threats, with Intelligent Assist providing event management to track investigation status and support structured response workflows. These capabilities enable the technical implementation of security controls that can be scaled and applied proportionally.

While these platforms provide the tools to implement and tailor controls, the overarching organizational policies, processes, and accountability structures that define what is ""appropriate to the magnitude of operations"" remain the customer's responsibility. This includes establishing the cadence for monitoring, defining accountability, conducting policy reviews, performing vendor assessments, and scheduling audits, which are essential components of a comprehensive, proportionally scaled security program."
7(b),"GOV-15, GOV-15.1, GOV-15.2, GOV-15.3, GOV-15.4, GOV-15.5, PRM-01, PRM-02, PRM-03, PRM-04, PRM-05, PRM-07",Reliable.,Contributes,"VMware Cloud Foundation provides the comprehensive monitoring infrastructure essential for maintaining reliable operations and ensuring ongoing oversight of technology assets. VCF Operations continuously monitors the infrastructure to identify compliance drift, surfacing non-compliant objects and associated violations through dashboards and alerts. Administrators define monitoring policies that govern resource analysis, with customizable policy element settings per object to tailor monitoring to individual asset risk profiles. Platform operators configure alerts, perform log analysis, troubleshoot, and run infrastructure diagnostics and health checks across the VCF environment.

VCF Operations for Logs aggregates log data from vCenter and ESX hosts, providing searchable dashboards and analytics for asset owners. VCF Automation adds resource usage monitoring and permission controls through its Organizations model, enabling IT teams to track consumption and enforce governance boundaries. On the user security side, VCF Operations supports continuous monitoring of user access patterns to detect security risks and verify appropriate access levels, with role-based access in vCenter, including a dedicated Operator role, facilitating delegation of monitoring responsibilities.

VMware vDefend's Security Intelligence further enhances reliability by providing continuous network-level monitoring through flow visualization, anomaly detection, and Network Detection and Response (NDR) capabilities, supporting ongoing assessment of control effectiveness across in-scope workloads and services. IDS/IPS and Advanced Threat Protection (ATP) continuously monitor network traffic for threats, while Intelligent Assist provides event management capabilities to track investigation status and support structured response workflows. The Admin Dashboard and Intelligent Assist integrate with security pages to surface events and support analyst workflows for continuous monitoring at the network layer.

While these capabilities provide robust tools for data and process owners to monitor their assets for threats, misconfigurations, and control failures, the organizational policies that mandate such monitoring, the defined cadence, and the accountability structures around that monitoring are governance responsibilities that reside outside the scope of the platform. Broader program-level monitoring activities, such as policy reviews, vendor assessments, or audit scheduling, also remain customer responsibilities."
7(c),"GOV-15, GOV-15.1, GOV-15.2, GOV-15.3, GOV-15.4, GOV-15.5, PRM-01, PRM-02, PRM-03, PRM-04, PRM-05, PRM-07","Equipped with sufficient capacity to accurately process data and timely provide services, and deal with peak volumes, including when new technology is introduced.",Contributes,"VMware Cloud Foundation provides the monitoring infrastructure to continuously assess technology assets, identify compliance drift, and surface non-compliant objects through dashboards and alerts. Administrators define monitoring policies and customize settings per object, tailoring oversight to individual asset risk profiles. Platform operators configure alerts, perform log analysis, troubleshoot, and run diagnostics and health checks across the environment.

VCF Operations for Logs aggregates data from vCenter and ESX hosts, offering searchable dashboards and analytics for visibility into component behavior. VCF Automation adds resource usage monitoring and permission controls through its Organizations model, enabling IT teams to track consumption and enforce governance boundaries. On the user security side, VCF Operations supports continuous monitoring of user access patterns to detect security risks and verify appropriate access levels.

VMware vDefend's Security Intelligence delivers continuous network-level monitoring through flow visualization, anomaly detection, and Network Detection and Response (NDR) capabilities, supporting ongoing assessment of control effectiveness across in-scope workloads and services. Intrusion Detection/Prevention Systems (IDS/IPS) and Advanced Threat Protection (ATP) continuously monitor network traffic for threats, with Intelligent Assist providing event management to track investigation status and support structured response workflows.

These capabilities provide the essential tools for monitoring capacity, performance, and security posture, which are critical for ensuring accurate data processing and timely service delivery.

The organization is responsible for establishing the policies, processes, and accountability structures that compel data and process owners to perform monitoring, define the cadence of such activities, and ensure that sufficient capacity is provisioned and maintained based on the insights derived from these monitoring tools. This includes defining capacity planning strategies, responding to identified capacity shortfalls or performance degradation, and integrating these technical capabilities into a broader governance framework."
7(d),"GOV-15, GOV-15.1, GOV-15.2, GOV-15.3, GOV-15.4, GOV-15.5, PRM-01, PRM-02, PRM-03, PRM-04, PRM-05, PRM-07",Technologically resilient to adequately deal with additional information processing needs as required under stressed market conditions or other adverse situations.,Contributes,"VMware Cloud Foundation provides the monitoring infrastructure necessary for continuous oversight of technology assets. VCF Operations actively monitors the infrastructure to identify compliance drift, surfacing non-compliant objects and associated violations through dashboards and alerts. Administrators can define monitoring policies, customize settings per object, perform log analysis, troubleshooting, and health checks across the VCF environment.

VCF Operations for Logs aggregates log data from vCenter and ESX hosts, providing searchable dashboards and analytics for visibility into component behavior.

VCF Automation tracks resource usage and enforces governance boundaries.

On the user security side, VCF Operations supports continuous monitoring of user access patterns to detect security risks.

VMware vDefend's Security Intelligence provides continuous network-level monitoring through flow visualization, anomaly detection, and Network Detection and Response (NDR) capabilities. Its IDS/IPS and Advanced Threat Protection (ATP) continuously monitor network traffic for threats, with Intelligent Assist facilitating event management and tracking investigation status. The Admin Dashboard and Intelligent Assist integrate to surface security events and support analyst workflows for ongoing monitoring.

While these platforms offer robust monitoring, logging, and security detection capabilities essential for understanding system behavior and identifying potential stress, they do not inherently provide the dynamic scaling, high availability, or disaster recovery mechanisms required to *deal with additional information processing needs* under stressed market conditions or adverse situations.

The customer is responsible for configuring the underlying infrastructure components to achieve the necessary technological resilience and processing capacity. Furthermore, the customer must establish organizational policies, operational procedures, and accountability structures to leverage these monitoring insights for proactive and reactive management of resilience."
8.1,PRM-06,"Financial entities shall identify, classify and adequately document all ICT supported business functions, roles, responsibilities, information assets and ICT assets supporting those functions, and their roles and dependencies in relation to ICT risk. This shall be reviewed at least yearly.",Not Applicable,"End user activity or process, design decision, or activity out of scope."
8.2,"RSK-01.1, RSK-03","Financial entities shall, on a continuous basis, identify all sources of ICT risk, and assess cyber threats and ICT vulnerabilities relevant to their ICT supported functions and assets, and review risk scenarios regularly, at least yearly.",Not Applicable,"End user activity or process, design decision, or activity out of scope."
8.3,RSK-04,"Financial entities, other than microenterprises, shall perform a risk assessment upon each major change in the network and information system infrastructure, processes or procedures affecting their ICT supported functions or assets.",Not Applicable,"End user activity or process, design decision, or activity out of scope."
8.4,"AST-02, AST-04, BCD-02, TPM-02","Financial entities shall identify all information assets and ICT assets (including remote sites, network resources, hardware) and shall map those considered critical. They shall map the configuration of assets and the links and interdependencies between them.",Contributes,"VMware Cloud Foundation provides a real-time, detailed inventory of compute, storage, and networking assets through vCenter, which serves as the authoritative source for managed objects. VCF Operations extends this with Service Discovery for applications and services, Business Applications for grouping and tagging with criticality, and Automation for tracking provisioned resources and modeling services with blueprints. VCF Operations for Networks offers interactive network maps, flow visualization, and application topology maps to detail network architecture and data flows, while vSphere Client provides topology views with dependency mapping. VCF also integrates with external CMDBs like ServiceNow for asset reconciliation. VMware Live Recovery explicitly identifies critical assets through protection groups and documents network mappings and configurations between protected and recovery sites, including replication traffic paths. VMware vDefend inventories network-visible workloads, classifies applications as critical, and provides dynamic visualizations of network traffic flows, security group relationships, and interdependencies, serving as a live source for network architecture and security posture.

While the platform provides robust technical tools for identifying, classifying, and mapping ICT assets, their configurations, and interdependencies, the organization remains responsible for defining enterprise-wide asset classification schemes, establishing business justification processes for criticality, and maintaining comprehensive asset registries that include all information assets, non-VCF managed ICT assets, and authorized software catalogs. Formal network architecture diagrams and data flow documentation, along with ensuring they reflect the current state and are integrated into broader configuration management processes, are also organizational responsibilities."
8.5,AST-01.1,"Financial entities shall identify and document all processes that are dependent on ICT third-party service providers, and shall identify interconnections with providers supporting critical or important functions.",Contributes,"VMware vDefend's Security Services Platform organizes inventory assets into a defined hierarchy spanning region, zone, environment, application, and application tier. It classifies assets as either infrastructure or applications, further distinguishing between critical and regular, which directly supports understanding which assets underpin critical business functions. Security Intelligence traffic flow analysis and visualization capabilities provide granular visibility into asset interdependencies and communication patterns at the network layer, aiding in the identification of service dependencies. The Security Services Platform inventory also facilitates importing asset information via CSV and enables filtering of infrastructure assets by name and status, thereby supporting comprehensive asset discovery and lifecycle tracking.

While these capabilities significantly contribute to network-layer asset inventory and dependency mapping, they do not constitute a comprehensive enterprise asset management system. The financial entity is responsible for formally identifying and documenting all business processes that are dependent on ICT third-party service providers. This includes establishing and maintaining a complete inventory of third-party service providers, their contractual relationships, and the specific critical or important functions they support, along with the interconnections at a business process level, which extends beyond the technical network layer."
